Bus 002 Device 003: ID 056a:0090 Wacom Co., Ltd TPC90
Device Descriptor:
  bLength                18
  bDescriptorType         1
  bcdUSB               1.10
  bDeviceClass            0 (Defined at Interface level)
  bDeviceSubClass         0 
  bDeviceProtocol         0 
  bMaxPacketSize0         8
  idVendor           0x056a Wacom Co., Ltd
  idProduct          0x0090 TPC90
  bcdDevice            0.05
  iManufacturer           1 Tablet
  iProduct                2 ISD-V4
  iSerial                 0 
  bNumConfigurations      1
  Configuration Descriptor:
    bLength                 9
    bDescriptorType         2
    wTotalLength           34
    bNumInterfaces          1
    bConfigurationValue     1
    iConfiguration          0 
    bmAttributes         0xe0
      Self Powered
      Remote Wakeup
    MaxPower               20mA
    Interface Descriptor:
      bLength                 9
      bDescriptorType         4
      bInterfaceNumber        0
      bAlternateSetting       0
      bNumEndpoints           1
      bInterfaceClass         3 Human Interface Device
      bInterfaceSubClass      1 Boot Interface Subclass
      bInterfaceProtocol      2 Mouse
      iInterface              0 
        HID Device Descriptor:
          bLength                 9
          bDescriptorType        33
          bcdHID               1.10
          bCountryCode            0 Not supported
          bNumDescriptors         1
          bDescriptorType        34 Report
          wDescriptorLength     141
          Report Descriptor: (length is 141)
            Item(Global): Usage Page, data= [ 0x0d ] 13
                            Digitizer
            Item(Local ): Usage, data= [ 0x02 ] 2
                            Pen
            Item(Main  ): Collection, data= [ 0x01 ] 1
                            Application
            Item(Global): Report ID, data= [ 0x01 ] 1
            Item(Local ): Usage, data= [ 0x20 ] 32
                            Stylus
            Item(Main  ): Collection, data= [ 0x00 ] 0
                            Physical
            Item(Local ): Usage, data= [ 0x42 ] 66
                            Tip Switch
            Item(Local ): Usage, data= [ 0x44 ] 68
                            Barrel Switch
            Item(Local ): Usage, data= [ 0x3c ] 60
                            Invert
            Item(Local ): Usage, data= [ 0x45 ] 69
                            Eraser
            Item(Local ): Usage, data= [ 0x00 ] 0
                            Undefined
            Item(Local ): Usage, data= [ 0x32 ] 50
                            In Range
            Item(Global): Logical Minimum, data= [ 0x00 ] 0
            Item(Global): Logical Maximum, data= [ 0x01 ] 1
            Item(Global): Report Size, data= [ 0x01 ] 1
            Item(Global): Report Count, data= [ 0x06 ] 6
            Item(Main  ): Input, data= [ 0x02 ] 2
                            Data Variable Absolute No_Wrap Linear
                            Preferred_State No_Null_Position Non_Volatile Bitfield
            Item(Global): Report Count, data= [ 0x02 ] 2
            Item(Main  ): Input, data= [ 0x03 ] 3
                            Constant Variable Absolute No_Wrap Linear
                            Preferred_State No_Null_Position Non_Volatile Bitfield
            Item(Global): Usage Page, data= [ 0x01 ] 1
                            Generic Desktop Controls
            Item(Local ): Usage, data= [ 0x30 ] 48
                            Direction-X
            Item(Global): Logical Maximum, data= [ 0xf8 0x52 ] 21240
            Item(Global): Physical Maximum, data= [ 0x4c 0x08 ] 2124
            Item(Global): Unit, data= [ 0x11 ] 17
                            System: SI Linear, Unit: Centimeter
            Item(Global): Unit Exponent, data= [ 0x0e ] 14
                            Unit Exponent: 14
            Item(Global): Report Size, data= [ 0x10 ] 16
            Item(Global): Report Count, data= [ 0x01 ] 1
            Item(Main  ): Input, data= [ 0x02 ] 2
                            Data Variable Absolute No_Wrap Linear
                            Preferred_State No_Null_Position Non_Volatile Bitfield
            Item(Local ): Usage, data= [ 0x31 ] 49
                            Direction-Y
            Item(Global): Logical Maximum, data= [ 0x6c 0x3e ] 15980
            Item(Global): Physical Maximum, data= [ 0x3e 0x06 ] 1598
            Item(Main  ): Input, data= [ 0x02 ] 2
                            Data Variable Absolute No_Wrap Linear
                            Preferred_State No_Null_Position Non_Volatile Bitfield
            Item(Global): Physical Maximum, data= [ 0x00 ] 0
            Item(Global): Unit, data= [ 0x00 ] 0
                            System: None, Unit: (None)
            Item(Global): Unit Exponent, data= [ 0x00 ] 0
                            Unit Exponent: 0
            Item(Global): Usage Page, data= [ 0x0d ] 13
                            Digitizer
            Item(Local ): Usage, data= [ 0x30 ] 48
                            Tip Pressure
            Item(Global): Logical Maximum, data= [ 0xff 0x00 ] 255
            Item(Main  ): Input, data= [ 0x02 ] 2
                            Data Variable Absolute No_Wrap Linear
                            Preferred_State No_Null_Position Non_Volatile Bitfield
            Item(Main  ): End Collection, data=none
            Item(Local ): Usage, data= [ 0x00 ] 0
                            Undefined
            Item(Global): Report Size, data= [ 0x08 ] 8
            Item(Main  ): Feature, data= [ 0x02 ] 2
                            Data Variable Absolute No_Wrap Linear
                            Preferred_State No_Null_Position Non_Volatile Bitfield
            Item(Main  ): End Collection, data=none
            Item(Global): Usage Page, data= [ 0x01 ] 1
                            Generic Desktop Controls
            Item(Local ): Usage, data= [ 0x02 ] 2
                            Mouse
            Item(Main  ): Collection, data= [ 0x01 ] 1
                            Application
            Item(Global): Report ID, data= [ 0x02 ] 2
            Item(Local ): Usage, data= [ 0x01 ] 1
                            Pointer
            Item(Main  ): Collection, data= [ 0x00 ] 0
                            Physical
            Item(Global): Usage Page, data= [ 0x09 ] 9
                            Buttons
            Item(Local ): Usage Minimum, data= [ 0x01 ] 1
                            Button 1 (Primary)
            Item(Local ): Usage Maximum, data= [ 0x02 ] 2
                            Button 2 (Secondary)
            Item(Global): Logical Minimum, data= [ 0x00 ] 0
            Item(Global): Logical Maximum, data= [ 0x01 ] 1
            Item(Global): Report Size, data= [ 0x01 ] 1
            Item(Global): Report Count, data= [ 0x02 ] 2
            Item(Main  ): Input, data= [ 0x02 ] 2
                            Data Variable Absolute No_Wrap Linear
                            Preferred_State No_Null_Position Non_Volatile Bitfield
            Item(Global): Report Count, data= [ 0x06 ] 6
            Item(Main  ): Input, data= [ 0x03 ] 3
                            Constant Variable Absolute No_Wrap Linear
                            Preferred_State No_Null_Position Non_Volatile Bitfield
            Item(Global): Usage Page, data= [ 0x01 ] 1
                            Generic Desktop Controls
            Item(Local ): Usage, data= [ 0x30 ] 48
                            Direction-X
            Item(Local ): Usage, data= [ 0x31 ] 49
                            Direction-Y
            Item(Global): Logical Minimum, data= [ 0x81 ] 129
            Item(Global): Logical Maximum, data= [ 0x7f ] 127
            Item(Global): Report Size, data= [ 0x08 ] 8
            Item(Global): Report Count, data= [ 0x02 ] 2
            Item(Main  ): Input, data= [ 0x06 ] 6
                            Data Variable Relative No_Wrap Linear
                            Preferred_State No_Null_Position Non_Volatile Bitfield
            Item(Main  ): End Collection, data=none
            Item(Main  ): End Collection, data=none
      Endpoint Descriptor:
        bLength                 7
        bDescriptorType         5
        bEndpointAddress     0x81  EP 1 IN
        bmAttributes            3
          Transfer Type            Interrupt
          Synch Type               None
          Usage Type               Data
        wMaxPacketSize     0x0008  1x 8 bytes
        bInterval              10
Device Status:     0x0000
  (Bus Powered)

