Bus 001 Device 003: ID 056a:0117 Wacom Co., Ltd
Device Descriptor:
  bLength                18
  bDescriptorType         1
  bcdUSB               2.01
  bDeviceClass            0 (Defined at Interface level)
  bDeviceSubClass         0
  bDeviceProtocol         0
  bMaxPacketSize0        64
  idVendor           0x056a Wacom Co., Ltd
  idProduct          0x0117
  bcdDevice            0.35
  iManufacturer           1 Wacom Co.,Ltd.
  iProduct                2 MultiTouch Sensor
  iSerial                 5
  bNumConfigurations      1
  Configuration Descriptor:
    bLength                 9
    bDescriptorType         2
    wTotalLength           59
    bNumInterfaces          2
    bConfigurationValue     1
    iConfiguration          0
    bmAttributes         0xe0
      Self Powered
      Remote Wakeup
    MaxPower               12mA
    Interface Descriptor:
      bLength                 9
      bDescriptorType         4
      bInterfaceNumber        0
      bAlternateSetting       0
      bNumEndpoints           1
      bInterfaceClass         3 Human Interface Device
      bInterfaceSubClass      0 No Subclass
      bInterfaceProtocol      0 None
      iInterface              3 MultiTouch
        HID Device Descriptor:
          bLength                 9
          bDescriptorType        33
          bcdHID               1.11
          bCountryCode            0 Not supported
          bNumDescriptors         1
          bDescriptorType        34 Report
          wDescriptorLength     588
          Report Descriptor: (length is 588)
            Item(Global): Usage Page, data= [ 0x0d ] 13
                            Digitizer
            Item(Local ): Usage, data= [ 0x04 ] 4
                            Touch Screen
            Item(Main  ): Collection, data= [ 0x01 ] 1
                            Application
            Item(Global): Report ID, data= [ 0x0c ] 12
            Item(Global): Report Count, data= [ 0x01 ] 1
            Item(Global): Report Size, data= [ 0x08 ] 8
            Item(Global): Logical Minimum, data= [ 0x00 ] 0
            Item(Global): Logical Maximum, data= [ 0xff 0x00 ] 255
            Item(Main  ): Input, data= [ 0x03 ] 3
                            Constant Variable Absolute No_Wrap Linear
                            Preferred_State No_Null_Position Non_Volatile Bitfield
            Item(Local ): Usage, data= [ 0x54 ] 84
                            Contact Count
            Item(Main  ): Input, data= [ 0x02 ] 2
                            Data Variable Absolute No_Wrap Linear
                            Preferred_State No_Null_Position Non_Volatile Bitfield
            Item(Local ): Usage, data= [ 0x22 ] 34
                            Finger
            Item(Main  ): Collection, data= [ 0x02 ] 2
                            Logical
            Item(Global): Usage Page, data= [ 0x0d ] 13
                            Digitizer
            Item(Global): Report Count, data= [ 0x01 ] 1
            Item(Global): Report Size, data= [ 0x01 ] 1
            Item(Global): Logical Maximum, data= [ 0x01 ] 1
            Item(Local ): Usage, data= [ 0x42 ] 66
                            Tip Switch
            Item(Main  ): Input, data= [ 0x02 ] 2
                            Data Variable Absolute No_Wrap Linear
                            Preferred_State No_Null_Position Non_Volatile Bitfield
            Item(Main  ): Input, data= [ 0x03 ] 3
                            Constant Variable Absolute No_Wrap Linear
                            Preferred_State No_Null_Position Non_Volatile Bitfield
            Item(Local ): Usage, data= [ 0x47 ] 71
                            Confidence
            Item(Main  ): Input, data= [ 0x02 ] 2
                            Data Variable Absolute No_Wrap Linear
                            Preferred_State No_Null_Position Non_Volatile Bitfield
            Item(Global): Report Count, data= [ 0x05 ] 5
            Item(Main  ): Input, data= [ 0x03 ] 3
                            Constant Variable Absolute No_Wrap Linear
                            Preferred_State No_Null_Position Non_Volatile Bitfield
            Item(Local ): Usage, data= [ 0x51 ] 81
                            Contact ID
            Item(Global): Logical Maximum, data= [ 0xff 0x00 ] 255
            Item(Global): Report Size, data= [ 0x10 ] 16
            Item(Global): Report Count, data= [ 0x01 ] 1
            Item(Main  ): Input, data= [ 0x02 ] 2
                            Data Variable Absolute No_Wrap Linear
                            Preferred_State No_Null_Position Non_Volatile Bitfield
            Item(Global): Physical Minimum, data= [ 0x00 ] 0
            Item(Global): Unit, data= [ 0x11 ] 17
                            System: SI Linear, Unit: Centimeter
            Item(Global): Unit Exponent, data= [ 0x0e ] 14
                            Unit Exponent: 14
            Item(Global): Usage Page, data= [ 0x01 ] 1
                            Generic Desktop Controls
            Item(Local ): Usage, data= [ 0x30 ] 48
                            Direction-X
            Item(Global): Logical Maximum, data= [ 0x10 0x2b ] 11024
            Item(Global): Physical Maximum, data= [ 0xc4 0x0a ] 2756
            Item(Main  ): Input, data= [ 0x42 ] 66
                            Data Variable Absolute No_Wrap Linear
                            Preferred_State Null_State Non_Volatile Bitfield
            Item(Local ): Usage, data= [ 0x31 ] 49
                            Direction-Y
            Item(Global): Logical Maximum, data= [ 0x34 0x18 ] 6196
            Item(Global): Physical Maximum, data= [ 0x0d 0x06 ] 1549
            Item(Main  ): Input, data= [ 0x42 ] 66
                            Data Variable Absolute No_Wrap Linear
                            Preferred_State Null_State Non_Volatile Bitfield
            Item(Global): Physical Maximum, data= [ 0x00 ] 0
            Item(Global): Unit, data= [ 0x00 ] 0
                            System: None, Unit: (None)
            Item(Global): Unit Exponent, data= [ 0x00 ] 0
                            Unit Exponent: 0
            Item(Main  ): End Collection, data=none
            Item(Global): Usage Page, data= [ 0x0d ] 13
                            Digitizer
            Item(Local ): Usage, data= [ 0x22 ] 34
                            Finger
            Item(Main  ): Collection, data= [ 0x02 ] 2
                            Logical
            Item(Global): Usage Page, data= [ 0x0d ] 13
                            Digitizer
            Item(Local ): Usage, data= [ 0x42 ] 66
                            Tip Switch
            Item(Global): Report Count, data= [ 0x01 ] 1
            Item(Global): Report Size, data= [ 0x01 ] 1
            Item(Global): Logical Maximum, data= [ 0x01 ] 1
            Item(Main  ): Input, data= [ 0x02 ] 2
                            Data Variable Absolute No_Wrap Linear
                            Preferred_State No_Null_Position Non_Volatile Bitfield
            Item(Main  ): Input, data= [ 0x03 ] 3
                            Constant Variable Absolute No_Wrap Linear
                            Preferred_State No_Null_Position Non_Volatile Bitfield
            Item(Local ): Usage, data= [ 0x47 ] 71
                            Confidence
            Item(Main  ): Input, data= [ 0x02 ] 2
                            Data Variable Absolute No_Wrap Linear
                            Preferred_State No_Null_Position Non_Volatile Bitfield
            Item(Global): Report Count, data= [ 0x05 ] 5
            Item(Main  ): Input, data= [ 0x03 ] 3
                            Constant Variable Absolute No_Wrap Linear
                            Preferred_State No_Null_Position Non_Volatile Bitfield
            Item(Local ): Usage, data= [ 0x51 ] 81
                            Contact ID
            Item(Global): Logical Maximum, data= [ 0xff 0x00 ] 255
            Item(Global): Report Size, data= [ 0x10 ] 16
            Item(Global): Report Count, data= [ 0x01 ] 1
            Item(Main  ): Input, data= [ 0x02 ] 2
                            Data Variable Absolute No_Wrap Linear
                            Preferred_State No_Null_Position Non_Volatile Bitfield
            Item(Global): Physical Minimum, data= [ 0x00 ] 0
            Item(Global): Unit, data= [ 0x11 ] 17
                            System: SI Linear, Unit: Centimeter
            Item(Global): Unit Exponent, data= [ 0x0e ] 14
                            Unit Exponent: 14
            Item(Global): Usage Page, data= [ 0x01 ] 1
                            Generic Desktop Controls
            Item(Local ): Usage, data= [ 0x30 ] 48
                            Direction-X
            Item(Global): Logical Maximum, data= [ 0x10 0x2b ] 11024
            Item(Global): Physical Maximum, data= [ 0xc4 0x0a ] 2756
            Item(Main  ): Input, data= [ 0x02 ] 2
                            Data Variable Absolute No_Wrap Linear
                            Preferred_State No_Null_Position Non_Volatile Bitfield
            Item(Local ): Usage, data= [ 0x31 ] 49
                            Direction-Y
            Item(Global): Logical Maximum, data= [ 0x34 0x18 ] 6196
            Item(Global): Physical Maximum, data= [ 0x0d 0x06 ] 1549
            Item(Main  ): Input, data= [ 0x02 ] 2
                            Data Variable Absolute No_Wrap Linear
                            Preferred_State No_Null_Position Non_Volatile Bitfield
            Item(Global): Physical Maximum, data= [ 0x00 ] 0
            Item(Global): Unit, data= [ 0x00 ] 0
                            System: None, Unit: (None)
            Item(Global): Unit Exponent, data= [ 0x00 ] 0
                            Unit Exponent: 0
            Item(Main  ): End Collection, data=none
            Item(Global): Usage Page, data= [ 0x0d ] 13
                            Digitizer
            Item(Local ): Usage, data= [ 0x22 ] 34
                            Finger
            Item(Main  ): Collection, data= [ 0x02 ] 2
                            Logical
            Item(Global): Usage Page, data= [ 0x0d ] 13
                            Digitizer
            Item(Local ): Usage, data= [ 0x42 ] 66
                            Tip Switch
            Item(Global): Report Count, data= [ 0x01 ] 1
            Item(Global): Report Size, data= [ 0x01 ] 1
            Item(Global): Logical Maximum, data= [ 0x01 ] 1
            Item(Main  ): Input, data= [ 0x02 ] 2
                            Data Variable Absolute No_Wrap Linear
                            Preferred_State No_Null_Position Non_Volatile Bitfield
            Item(Main  ): Input, data= [ 0x03 ] 3
                            Constant Variable Absolute No_Wrap Linear
                            Preferred_State No_Null_Position Non_Volatile Bitfield
            Item(Local ): Usage, data= [ 0x47 ] 71
                            Confidence
            Item(Main  ): Input, data= [ 0x02 ] 2
                            Data Variable Absolute No_Wrap Linear
                            Preferred_State No_Null_Position Non_Volatile Bitfield
            Item(Global): Report Count, data= [ 0x05 ] 5
            Item(Main  ): Input, data= [ 0x03 ] 3
                            Constant Variable Absolute No_Wrap Linear
                            Preferred_State No_Null_Position Non_Volatile Bitfield
            Item(Local ): Usage, data= [ 0x51 ] 81
                            Contact ID
            Item(Global): Logical Maximum, data= [ 0xff 0x00 ] 255
            Item(Global): Report Size, data= [ 0x10 ] 16
            Item(Global): Report Count, data= [ 0x01 ] 1
            Item(Main  ): Input, data= [ 0x02 ] 2
                            Data Variable Absolute No_Wrap Linear
                            Preferred_State No_Null_Position Non_Volatile Bitfield
            Item(Global): Physical Minimum, data= [ 0x00 ] 0
            Item(Global): Unit, data= [ 0x11 ] 17
                            System: SI Linear, Unit: Centimeter
            Item(Global): Unit Exponent, data= [ 0x0e ] 14
                            Unit Exponent: 14
            Item(Global): Usage Page, data= [ 0x01 ] 1
                            Generic Desktop Controls
            Item(Local ): Usage, data= [ 0x30 ] 48
                            Direction-X
            Item(Global): Logical Maximum, data= [ 0x10 0x2b ] 11024
            Item(Global): Physical Maximum, data= [ 0xc4 0x0a ] 2756
            Item(Main  ): Input, data= [ 0x02 ] 2
                            Data Variable Absolute No_Wrap Linear
                            Preferred_State No_Null_Position Non_Volatile Bitfield
            Item(Local ): Usage, data= [ 0x31 ] 49
                            Direction-Y
            Item(Global): Logical Maximum, data= [ 0x34 0x18 ] 6196
            Item(Global): Physical Maximum, data= [ 0x0d 0x06 ] 1549
            Item(Main  ): Input, data= [ 0x02 ] 2
                            Data Variable Absolute No_Wrap Linear
                            Preferred_State No_Null_Position Non_Volatile Bitfield
            Item(Global): Physical Maximum, data= [ 0x00 ] 0
            Item(Global): Unit, data= [ 0x00 ] 0
                            System: None, Unit: (None)
            Item(Global): Unit Exponent, data= [ 0x00 ] 0
                            Unit Exponent: 0
            Item(Main  ): End Collection, data=none
            Item(Global): Usage Page, data= [ 0x0d ] 13
                            Digitizer
            Item(Local ): Usage, data= [ 0x22 ] 34
                            Finger
            Item(Main  ): Collection, data= [ 0x02 ] 2
                            Logical
            Item(Global): Usage Page, data= [ 0x0d ] 13
                            Digitizer
            Item(Local ): Usage, data= [ 0x42 ] 66
                            Tip Switch
            Item(Global): Report Count, data= [ 0x01 ] 1
            Item(Global): Report Size, data= [ 0x01 ] 1
            Item(Global): Logical Maximum, data= [ 0x01 ] 1
            Item(Main  ): Input, data= [ 0x02 ] 2
                            Data Variable Absolute No_Wrap Linear
                            Preferred_State No_Null_Position Non_Volatile Bitfield
            Item(Main  ): Input, data= [ 0x03 ] 3
                            Constant Variable Absolute No_Wrap Linear
                            Preferred_State No_Null_Position Non_Volatile Bitfield
            Item(Local ): Usage, data= [ 0x47 ] 71
                            Confidence
            Item(Main  ): Input, data= [ 0x02 ] 2
                            Data Variable Absolute No_Wrap Linear
                            Preferred_State No_Null_Position Non_Volatile Bitfield
            Item(Global): Report Count, data= [ 0x05 ] 5
            Item(Main  ): Input, data= [ 0x03 ] 3
                            Constant Variable Absolute No_Wrap Linear
                            Preferred_State No_Null_Position Non_Volatile Bitfield
            Item(Local ): Usage, data= [ 0x51 ] 81
                            Contact ID
            Item(Global): Logical Maximum, data= [ 0xff 0x00 ] 255
            Item(Global): Report Size, data= [ 0x10 ] 16
            Item(Global): Report Count, data= [ 0x01 ] 1
            Item(Main  ): Input, data= [ 0x02 ] 2
                            Data Variable Absolute No_Wrap Linear
                            Preferred_State No_Null_Position Non_Volatile Bitfield
            Item(Global): Physical Minimum, data= [ 0x00 ] 0
            Item(Global): Unit, data= [ 0x11 ] 17
                            System: SI Linear, Unit: Centimeter
            Item(Global): Unit Exponent, data= [ 0x0e ] 14
                            Unit Exponent: 14
            Item(Global): Usage Page, data= [ 0x01 ] 1
                            Generic Desktop Controls
            Item(Local ): Usage, data= [ 0x30 ] 48
                            Direction-X
            Item(Global): Logical Maximum, data= [ 0x10 0x2b ] 11024
            Item(Global): Physical Maximum, data= [ 0xc4 0x0a ] 2756
            Item(Main  ): Input, data= [ 0x02 ] 2
                            Data Variable Absolute No_Wrap Linear
                            Preferred_State No_Null_Position Non_Volatile Bitfield
            Item(Local ): Usage, data= [ 0x31 ] 49
                            Direction-Y
            Item(Global): Logical Maximum, data= [ 0x34 0x18 ] 6196
            Item(Global): Physical Maximum, data= [ 0x0d 0x06 ] 1549
            Item(Main  ): Input, data= [ 0x02 ] 2
                            Data Variable Absolute No_Wrap Linear
                            Preferred_State No_Null_Position Non_Volatile Bitfield
            Item(Global): Physical Maximum, data= [ 0x00 ] 0
            Item(Global): Unit, data= [ 0x00 ] 0
                            System: None, Unit: (None)
            Item(Global): Unit Exponent, data= [ 0x00 ] 0
                            Unit Exponent: 0
            Item(Main  ): End Collection, data=none
            Item(Global): Usage Page, data= [ 0x0d ] 13
                            Digitizer
            Item(Local ): Usage, data= [ 0x22 ] 34
                            Finger
            Item(Main  ): Collection, data= [ 0x02 ] 2
                            Logical
            Item(Global): Usage Page, data= [ 0x0d ] 13
                            Digitizer
            Item(Local ): Usage, data= [ 0x42 ] 66
                            Tip Switch
            Item(Global): Report Count, data= [ 0x01 ] 1
            Item(Global): Report Size, data= [ 0x01 ] 1
            Item(Global): Logical Maximum, data= [ 0x01 ] 1
            Item(Main  ): Input, data= [ 0x02 ] 2
                            Data Variable Absolute No_Wrap Linear
                            Preferred_State No_Null_Position Non_Volatile Bitfield
            Item(Main  ): Input, data= [ 0x03 ] 3
                            Constant Variable Absolute No_Wrap Linear
                            Preferred_State No_Null_Position Non_Volatile Bitfield
            Item(Local ): Usage, data= [ 0x47 ] 71
                            Confidence
            Item(Main  ): Input, data= [ 0x02 ] 2
                            Data Variable Absolute No_Wrap Linear
                            Preferred_State No_Null_Position Non_Volatile Bitfield
            Item(Global): Report Count, data= [ 0x05 ] 5
            Item(Main  ): Input, data= [ 0x03 ] 3
                            Constant Variable Absolute No_Wrap Linear
                            Preferred_State No_Null_Position Non_Volatile Bitfield
            Item(Local ): Usage, data= [ 0x51 ] 81
                            Contact ID
            Item(Global): Logical Maximum, data= [ 0xff 0x00 ] 255
            Item(Global): Report Size, data= [ 0x10 ] 16
            Item(Global): Report Count, data= [ 0x01 ] 1
            Item(Main  ): Input, data= [ 0x02 ] 2
                            Data Variable Absolute No_Wrap Linear
                            Preferred_State No_Null_Position Non_Volatile Bitfield
            Item(Global): Physical Minimum, data= [ 0x00 ] 0
            Item(Global): Unit, data= [ 0x11 ] 17
                            System: SI Linear, Unit: Centimeter
            Item(Global): Unit Exponent, data= [ 0x0e ] 14
                            Unit Exponent: 14
            Item(Global): Usage Page, data= [ 0x01 ] 1
                            Generic Desktop Controls
            Item(Local ): Usage, data= [ 0x30 ] 48
                            Direction-X
            Item(Global): Logical Maximum, data= [ 0x10 0x2b ] 11024
            Item(Global): Physical Maximum, data= [ 0xc4 0x0a ] 2756
            Item(Main  ): Input, data= [ 0x02 ] 2
                            Data Variable Absolute No_Wrap Linear
                            Preferred_State No_Null_Position Non_Volatile Bitfield
            Item(Local ): Usage, data= [ 0x31 ] 49
                            Direction-Y
            Item(Global): Logical Maximum, data= [ 0x34 0x18 ] 6196
            Item(Global): Physical Maximum, data= [ 0x0d 0x06 ] 1549
            Item(Main  ): Input, data= [ 0x02 ] 2
                            Data Variable Absolute No_Wrap Linear
                            Preferred_State No_Null_Position Non_Volatile Bitfield
            Item(Global): Physical Maximum, data= [ 0x00 ] 0
            Item(Global): Unit, data= [ 0x00 ] 0
                            System: None, Unit: (None)
            Item(Global): Unit Exponent, data= [ 0x00 ] 0
                            Unit Exponent: 0
            Item(Main  ): End Collection, data=none
            Item(Global): Usage Page, data= [ 0x0d ] 13
                            Digitizer
            Item(Global): Logical Maximum, data= [ 0xff 0xff 0x00 0x00 ] 65535
            Item(Local ): Usage, data= [ 0x56 ] 86
                            (null)
            Item(Main  ): Input, data= [ 0x02 ] 2
                            Data Variable Absolute No_Wrap Linear
                            Preferred_State No_Null_Position Non_Volatile Bitfield
            Item(Local ): Usage, data= [ 0x55 ] 85
                            Maximum Contact Number
            Item(Global): Logical Maximum, data= [ 0xff 0x00 ] 255
            Item(Global): Report Size, data= [ 0x08 ] 8
            Item(Main  ): Feature, data= [ 0x02 ] 2
                            Data Variable Absolute No_Wrap Linear
                            Preferred_State No_Null_Position Non_Volatile Bitfield
            Item(Global): Report ID, data= [ 0x0a ] 10
            Item(Global): Usage Page, data= [ 0x00 0xff ] 65280
                            (null)
            Item(Local ): Usage, data= [ 0xc5 ] 197
                            (null)
            Item(Global): Report Count, data= [ 0x00 0x01 ] 256
            Item(Main  ): Feature, data= [ 0x02 ] 2
                            Data Variable Absolute No_Wrap Linear
                            Preferred_State No_Null_Position Non_Volatile Bitfield
            Item(Main  ): End Collection, data=none
            Item(Global): Usage Page, data= [ 0x0d ] 13
                            Digitizer
            Item(Local ): Usage, data= [ 0x0e ] 14
                            (null)
            Item(Main  ): Collection, data= [ 0x01 ] 1
                            Application
            Item(Global): Report ID, data= [ 0x0e ] 14
            Item(Local ): Usage, data= [ 0x23 ] 35
                            (null)
            Item(Main  ): Collection, data= [ 0x02 ] 2
                            Logical
            Item(Local ): Usage, data= [ 0x52 ] 82
                            Input Mode
            Item(Local ): Usage, data= [ 0x53 ] 83
                            Device Index
            Item(Global): Logical Minimum, data= [ 0x00 ] 0
            Item(Global): Logical Maximum, data= [ 0x0a ] 10
            Item(Global): Report Size, data= [ 0x08 ] 8
            Item(Global): Report Count, data= [ 0x02 ] 2
            Item(Main  ): Feature, data= [ 0x02 ] 2
                            Data Variable Absolute No_Wrap Linear
                            Preferred_State No_Null_Position Non_Volatile Bitfield
            Item(Main  ): End Collection, data=none
            Item(Main  ): End Collection, data=none
            Item(Global): Usage Page, data= [ 0x09 0xff ] 65289
                            (null)
            Item(Local ): Usage, data= [ 0x11 ] 17
                            (null)
            Item(Main  ): Collection, data= [ 0x01 ] 1
                            Application
            Item(Global): Report ID, data= [ 0x03 ] 3
            Item(Main  ): Collection, data= [ 0x02 ] 2
                            Logical
            Item(Local ): Usage, data= [ 0x00 ] 0
                            (null)
            Item(Global): Report Size, data= [ 0x08 ] 8
            Item(Global): Logical Minimum, data= [ 0x00 ] 0
            Item(Global): Logical Maximum, data= [ 0xff 0x00 ] 255
            Item(Global): Report Count, data= [ 0x27 0x00 ] 39
            Item(Main  ): Input, data= [ 0x02 ] 2
                            Data Variable Absolute No_Wrap Linear
                            Preferred_State No_Null_Position Non_Volatile Bitfield
            Item(Main  ): End Collection, data=none
            Item(Global): Report ID, data= [ 0x03 ] 3
            Item(Local ): Usage, data= [ 0x00 ] 0
                            (null)
            Item(Global): Report Count, data= [ 0x03 ] 3
            Item(Main  ): Feature, data= [ 0x02 ] 2
                            Data Variable Absolute No_Wrap Linear
                            Preferred_State No_Null_Position Non_Volatile Bitfield
            Item(Global): Report ID, data= [ 0x09 ] 9
            Item(Local ): Usage, data= [ 0x00 ] 0
                            (null)
            Item(Global): Report Count, data= [ 0x3f ] 63
            Item(Main  ): Feature, data= [ 0x02 ] 2
                            Data Variable Absolute No_Wrap Linear
                            Preferred_State No_Null_Position Non_Volatile Bitfield
            Item(Global): Report ID, data= [ 0x02 ] 2
            Item(Local ): Usage, data= [ 0x00 ] 0
                            (null)
            Item(Global): Report Count, data= [ 0x01 ] 1
            Item(Main  ): Feature, data= [ 0x02 ] 2
                            Data Variable Absolute No_Wrap Linear
                            Preferred_State No_Null_Position Non_Volatile Bitfield
            Item(Global): Report ID, data= [ 0x04 ] 4
            Item(Local ): Usage, data= [ 0x00 ] 0
                            (null)
            Item(Global): Report Count, data= [ 0x0f ] 15
            Item(Main  ): Feature, data= [ 0x02 ] 2
                            Data Variable Absolute No_Wrap Linear
                            Preferred_State No_Null_Position Non_Volatile Bitfield
            Item(Global): Report ID, data= [ 0x07 ] 7
            Item(Local ): Usage, data= [ 0x00 ] 0
                            (null)
            Item(Global): Report Count, data= [ 0x07 0x02 ] 519
            Item(Main  ): Feature, data= [ 0x02 ] 2
                            Data Variable Absolute No_Wrap Linear
                            Preferred_State No_Null_Position Non_Volatile Bitfield
            Item(Global): Report ID, data= [ 0x08 ] 8
            Item(Local ): Usage, data= [ 0x00 ] 0
                            (null)
            Item(Global): Report Count, data= [ 0x87 0x00 ] 135
            Item(Main  ): Feature, data= [ 0x02 ] 2
                            Data Variable Absolute No_Wrap Linear
                            Preferred_State No_Null_Position Non_Volatile Bitfield
            Item(Global): Report ID, data= [ 0x0d ] 13
            Item(Local ): Usage, data= [ 0x00 ] 0
                            (null)
            Item(Global): Report Count, data= [ 0x03 ] 3
            Item(Main  ): Feature, data= [ 0x02 ] 2
                            Data Variable Absolute No_Wrap Linear
                            Preferred_State No_Null_Position Non_Volatile Bitfield
            Item(Main  ): End Collection, data=none
            Item(Global): Usage Page, data= [ 0x01 ] 1
                            Generic Desktop Controls
            Item(Local ): Usage, data= [ 0x02 ] 2
                            Mouse
            Item(Main  ): Collection, data= [ 0x01 ] 1
                            Application
            Item(Global): Report ID, data= [ 0x01 ] 1
            Item(Local ): Usage, data= [ 0x01 ] 1
                            Pointer
            Item(Main  ): Collection, data= [ 0x00 ] 0
                            Physical
            Item(Global): Usage Page, data= [ 0x09 ] 9
                            Buttons
            Item(Local ): Usage Minimum, data= [ 0x01 ] 1
                            Button 1 (Primary)
            Item(Local ): Usage Maximum, data= [ 0x02 ] 2
                            Button 2 (Secondary)
            Item(Global): Logical Minimum, data= [ 0x00 ] 0
            Item(Global): Logical Maximum, data= [ 0x01 ] 1
            Item(Global): Report Count, data= [ 0x02 ] 2
            Item(Global): Report Size, data= [ 0x01 ] 1
            Item(Main  ): Input, data= [ 0x02 ] 2
                            Data Variable Absolute No_Wrap Linear
                            Preferred_State No_Null_Position Non_Volatile Bitfield
            Item(Global): Report Count, data= [ 0x01 ] 1
            Item(Global): Report Size, data= [ 0x06 ] 6
            Item(Main  ): Input, data= [ 0x03 ] 3
                            Constant Variable Absolute No_Wrap Linear
                            Preferred_State No_Null_Position Non_Volatile Bitfield
            Item(Global): Usage Page, data= [ 0x01 ] 1
                            Generic Desktop Controls
            Item(Local ): Usage, data= [ 0x30 ] 48
                            Direction-X
            Item(Local ): Usage, data= [ 0x31 ] 49
                            Direction-Y
            Item(Global): Logical Maximum, data= [ 0xff 0x7f ] 32767
            Item(Global): Report Size, data= [ 0x10 ] 16
            Item(Global): Report Count, data= [ 0x02 ] 2
            Item(Main  ): Input, data= [ 0x02 ] 2
                            Data Variable Absolute No_Wrap Linear
                            Preferred_State No_Null_Position Non_Volatile Bitfield
            Item(Main  ): End Collection, data=none
            Item(Main  ): End Collection, data=none
      Endpoint Descriptor:
        bLength                 7
        bDescriptorType         5
        bEndpointAddress     0x81  EP 1 IN
        bmAttributes            3
          Transfer Type            Interrupt
          Synch Type               None
          Usage Type               Data
        wMaxPacketSize     0x0040  1x 64 bytes
        bInterval               2
    Interface Descriptor:
      bLength                 9
      bDescriptorType         4
      bInterfaceNumber        1
      bAlternateSetting       0
      bNumEndpoints           1
      bInterfaceClass         3 Human Interface Device
      bInterfaceSubClass      0 No Subclass
      bInterfaceProtocol      0 None
      iInterface              4 Pen
        HID Device Descriptor:
          bLength                 9
          bDescriptorType        33
          bcdHID               1.11
          bCountryCode            0 Not supported
          bNumDescriptors         1
          bDescriptorType        34 Report
          wDescriptorLength     127
         Report Descriptors:
           ** UNAVAILABLE **
      Endpoint Descriptor:
        bLength                 7
        bDescriptorType         5
        bEndpointAddress     0x83  EP 3 IN
        bmAttributes            3
          Transfer Type            Interrupt
          Synch Type               None
          Usage Type               Data
        wMaxPacketSize     0x0040  1x 64 bytes
        bInterval               2
Binary Object Store Descriptor:
  bLength                 5
  bDescriptorType        15
  wTotalLength           33
  bNumDeviceCaps          1
  ** UNRECOGNIZED:  1c 10 05 00 df 60 dd d8 89 45 c7 4c 9c d2 65 9d 9e 64 8a 9f 00 00 03 06 48 00 04 00
Device Status:     0x0000
  (Bus Powered)
