Bus 003 Device 004: ID 056a:00f5 Wacom Co., Ltd 
Device Descriptor:
  bLength                18
  bDescriptorType         1
  bcdUSB               1.10
  bDeviceClass            0 (Defined at Interface level)
  bDeviceSubClass         0 
  bDeviceProtocol         0 
  bMaxPacketSize0        64
  idVendor           0x056a Wacom Co., Ltd
  idProduct          0x00f5 
  bcdDevice            0.01
  iManufacturer           1 WACOM
  iProduct                2 Cintiq 24HDT Monitor Control
  iSerial                 3 3DAN100024
  bNumConfigurations      1
  Configuration Descriptor:
    bLength                 9
    bDescriptorType         2
    wTotalLength           41
    bNumInterfaces          1
    bConfigurationValue     1
    iConfiguration          0 
    bmAttributes         0xc0
      Self Powered
    MaxPower                0mA
    Interface Descriptor:
      bLength                 9
      bDescriptorType         4
      bInterfaceNumber        0
      bAlternateSetting       0
      bNumEndpoints           2
      bInterfaceClass         3 Human Interface Device
      bInterfaceSubClass      0 No Subclass
      bInterfaceProtocol      0 None
      iInterface              0 
        HID Device Descriptor:
          bLength                 9
          bDescriptorType        33
          bcdHID               1.10
          bCountryCode            0 Not supported
          bNumDescriptors         1
          bDescriptorType        34 Report
          wDescriptorLength      39
          Report Descriptor: (length is 39)
            Item(Global): Usage Page, data= [ 0x00 0xff ] 65280
                            (null)
            Item(Local ): Usage, data= [ 0x01 ] 1
                            (null)
            Item(Main  ): Collection, data= [ 0x01 ] 1
                            Application
            Item(Local ): Usage, data= [ 0x02 ] 2
                            (null)
            Item(Main  ): Collection, data= [ 0x00 ] 0
                            Physical
            Item(Local ): Usage, data= [ 0x03 ] 3
                            (null)
            Item(Global): Report Count, data= [ 0x40 ] 64
            Item(Global): Report Size, data= [ 0x08 ] 8
            Item(Global): Logical Minimum, data= [ 0x00 ] 0
            Item(Global): Logical Maximum, data= [ 0xff 0x00 ] 255
            Item(Main  ): Input, data= [ 0x02 ] 2
                            Data Variable Absolute No_Wrap Linear
                            Preferred_State No_Null_Position Non_Volatile Bitfield
            Item(Local ): Usage, data= [ 0x04 ] 4
                            (null)
            Item(Global): Report Count, data= [ 0x40 ] 64
            Item(Global): Report Size, data= [ 0x08 ] 8
            Item(Global): Logical Minimum, data= [ 0x00 ] 0
            Item(Global): Logical Maximum, data= [ 0xff 0x00 ] 255
            Item(Main  ): Output, data= [ 0x02 ] 2
                            Data Variable Absolute No_Wrap Linear
                            Preferred_State No_Null_Position Non_Volatile Bitfield
            Item(Main  ): End Collection, data=none
            Item(Main  ): End Collection, data=none
      Endpoint Descriptor:
        bLength                 7
        bDescriptorType         5
        bEndpointAddress     0x81  EP 1 IN
        bmAttributes            3
          Transfer Type            Interrupt
          Synch Type               None
          Usage Type               Data
        wMaxPacketSize     0x0040  1x 64 bytes
        bInterval               1
      Endpoint Descriptor:
        bLength                 7
        bDescriptorType         5
        bEndpointAddress     0x02  EP 2 OUT
        bmAttributes            3
          Transfer Type            Interrupt
          Synch Type               None
          Usage Type               Data
        wMaxPacketSize     0x0040  1x 64 bytes
        bInterval               1
Device Status:     0x0001
  Self Powered

Bus 003 Device 005: ID 056a:00f6 Wacom Co., Ltd 
Device Descriptor:
  bLength                18
  bDescriptorType         1
  bcdUSB               2.00
  bDeviceClass            0 (Defined at Interface level)
  bDeviceSubClass         0 
  bDeviceProtocol         0 
  bMaxPacketSize0        64
  idVendor           0x056a Wacom Co., Ltd
  idProduct          0x00f6 
  bcdDevice            1.06
  iManufacturer           1 Wacom Co.,Ltd.
  iProduct                2 Cintiq 24HDT Touch
  iSerial                 0 
  bNumConfigurations      1
  Configuration Descriptor:
    bLength                 9
    bDescriptorType         2
    wTotalLength           57
    bNumInterfaces          2
    bConfigurationValue     1
    iConfiguration          0 
    bmAttributes         0xc0
      Self Powered
    MaxPower                0mA
    Interface Descriptor:
      bLength                 9
      bDescriptorType         4
      bInterfaceNumber        0
      bAlternateSetting       0
      bNumEndpoints           2
      bInterfaceClass       255 Vendor Specific Class
      bInterfaceSubClass      0 
      bInterfaceProtocol      0 
      iInterface              0 
      Endpoint Descriptor:
        bLength                 7
        bDescriptorType         5
        bEndpointAddress     0x87  EP 7 IN
        bmAttributes            3
          Transfer Type            Interrupt
          Synch Type               None
          Usage Type               Data
        wMaxPacketSize     0x0008  1x 8 bytes
        bInterval               3
      Endpoint Descriptor:
        bLength                 7
        bDescriptorType         5
        bEndpointAddress     0x81  EP 1 IN
        bmAttributes            2
          Transfer Type            Bulk
          Synch Type               None
          Usage Type               Data
        wMaxPacketSize     0x0040  1x 64 bytes
        bInterval               0
    Interface Descriptor:
      bLength                 9
      bDescriptorType         4
      bInterfaceNumber        1
      bAlternateSetting       0
      bNumEndpoints           1
      bInterfaceClass         3 Human Interface Device
      bInterfaceSubClass      0 No Subclass
      bInterfaceProtocol      0 None
      iInterface              0 
        HID Device Descriptor:
          bLength                 9
          bDescriptorType        33
          bcdHID               1.10
          bCountryCode            0 Not supported
          bNumDescriptors         1
          bDescriptorType        34 Report
          wDescriptorLength     568
          Report Descriptor: (length is 568)
            Item(Global): Usage Page, data= [ 0x0d ] 13
                            Digitizer
            Item(Local ): Usage, data= [ 0x04 ] 4
                            Touch Screen
            Item(Main  ): Collection, data= [ 0x01 ] 1
                            Application
            Item(Global): Report ID, data= [ 0x01 ] 1
            Item(Local ): Usage, data= [ 0x22 ] 34
                            Finger
            Item(Main  ): Collection, data= [ 0x02 ] 2
                            Logical
            Item(Local ): Usage, data= [ 0x42 ] 66
                            Tip Switch
            Item(Global): Logical Minimum, data= [ 0x00 ] 0
            Item(Global): Logical Maximum, data= [ 0x01 ] 1
            Item(Global): Report Size, data= [ 0x01 ] 1
            Item(Global): Report Count, data= [ 0x01 ] 1
            Item(Main  ): Input, data= [ 0x02 ] 2
                            Data Variable Absolute No_Wrap Linear
                            Preferred_State No_Null_Position Non_Volatile Bitfield
            Item(Local ): Usage, data= [ 0x32 ] 50
                            In Range
            Item(Main  ): Input, data= [ 0x02 ] 2
                            Data Variable Absolute No_Wrap Linear
                            Preferred_State No_Null_Position Non_Volatile Bitfield
            Item(Global): Report Count, data= [ 0x06 ] 6
            Item(Main  ): Input, data= [ 0x03 ] 3
                            Constant Variable Absolute No_Wrap Linear
                            Preferred_State No_Null_Position Non_Volatile Bitfield
            Item(Global): Report Size, data= [ 0x08 ] 8
            Item(Local ): Usage, data= [ 0x51 ] 81
                            Contact ID
            Item(Global): Report Count, data= [ 0x01 ] 1
            Item(Main  ): Input, data= [ 0x02 ] 2
                            Data Variable Absolute No_Wrap Linear
                            Preferred_State No_Null_Position Non_Volatile Bitfield
            Item(Global): Usage Page, data= [ 0x01 ] 1
                            Generic Desktop Controls
            Item(Global): Report Size, data= [ 0x10 ] 16
            Item(Global): Report Count, data= [ 0x02 ] 2
            Item(Global): Unit Exponent, data= [ 0x0e ] 14
                            Unit Exponent: 14
            Item(Global): Unit, data= [ 0x11 ] 17
                            System: SI Linear, Unit: Centimeter
            Item(Local ): Usage, data= [ 0x30 ] 48
                            Direction-X
            Item(Global): Logical Maximum, data= [ 0x40 0x14 ] 5184
            Item(Global): Physical Minimum, data= [ 0x00 ] 0
            Item(Global): Physical Maximum, data= [ 0x40 0x14 ] 5184
            Item(Main  ): Input, data= [ 0x02 ] 2
                            Data Variable Absolute No_Wrap Linear
                            Preferred_State No_Null_Position Non_Volatile Bitfield
            Item(Global): Physical Maximum, data= [ 0xa8 0x0c ] 3240
            Item(Local ): Usage, data= [ 0x31 ] 49
                            Direction-Y
            Item(Global): Logical Maximum, data= [ 0xa8 0x0c ] 3240
            Item(Main  ): Input, data= [ 0x02 ] 2
                            Data Variable Absolute No_Wrap Linear
                            Preferred_State No_Null_Position Non_Volatile Bitfield
            Item(Global): Usage Page, data= [ 0x0d ] 13
                            Digitizer
            Item(Global): Report Count, data= [ 0x01 ] 1
            Item(Local ): Usage, data= [ 0x48 ] 72
                            Width
            Item(Main  ): Input, data= [ 0x02 ] 2
                            Data Variable Absolute No_Wrap Linear
                            Preferred_State No_Null_Position Non_Volatile Bitfield
            Item(Local ): Usage, data= [ 0x49 ] 73
                            Height
            Item(Main  ): Input, data= [ 0x02 ] 2
                            Data Variable Absolute No_Wrap Linear
                            Preferred_State No_Null_Position Non_Volatile Bitfield
            Item(Main  ): End Collection, data=none
            Item(Global): Usage Page, data= [ 0x0d ] 13
                            Digitizer
            Item(Local ): Usage, data= [ 0x22 ] 34
                            Finger
            Item(Main  ): Collection, data= [ 0x02 ] 2
                            Logical
            Item(Local ): Usage, data= [ 0x42 ] 66
                            Tip Switch
            Item(Global): Logical Minimum, data= [ 0x00 ] 0
            Item(Global): Logical Maximum, data= [ 0x01 ] 1
            Item(Global): Report Size, data= [ 0x01 ] 1
            Item(Global): Report Count, data= [ 0x01 ] 1
            Item(Main  ): Input, data= [ 0x02 ] 2
                            Data Variable Absolute No_Wrap Linear
                            Preferred_State No_Null_Position Non_Volatile Bitfield
            Item(Local ): Usage, data= [ 0x32 ] 50
                            In Range
            Item(Main  ): Input, data= [ 0x02 ] 2
                            Data Variable Absolute No_Wrap Linear
                            Preferred_State No_Null_Position Non_Volatile Bitfield
            Item(Global): Report Count, data= [ 0x06 ] 6
            Item(Main  ): Input, data= [ 0x03 ] 3
                            Constant Variable Absolute No_Wrap Linear
                            Preferred_State No_Null_Position Non_Volatile Bitfield
            Item(Global): Report Size, data= [ 0x08 ] 8
            Item(Local ): Usage, data= [ 0x51 ] 81
                            Contact ID
            Item(Global): Report Count, data= [ 0x01 ] 1
            Item(Main  ): Input, data= [ 0x02 ] 2
                            Data Variable Absolute No_Wrap Linear
                            Preferred_State No_Null_Position Non_Volatile Bitfield
            Item(Global): Usage Page, data= [ 0x01 ] 1
                            Generic Desktop Controls
            Item(Global): Report Size, data= [ 0x10 ] 16
            Item(Global): Report Count, data= [ 0x02 ] 2
            Item(Global): Unit Exponent, data= [ 0x0e ] 14
                            Unit Exponent: 14
            Item(Global): Unit, data= [ 0x11 ] 17
                            System: SI Linear, Unit: Centimeter
            Item(Local ): Usage, data= [ 0x30 ] 48
                            Direction-X
            Item(Global): Logical Maximum, data= [ 0x40 0x14 ] 5184
            Item(Global): Physical Minimum, data= [ 0x00 ] 0
            Item(Global): Physical Maximum, data= [ 0x40 0x14 ] 5184
            Item(Main  ): Input, data= [ 0x02 ] 2
                            Data Variable Absolute No_Wrap Linear
                            Preferred_State No_Null_Position Non_Volatile Bitfield
            Item(Global): Physical Maximum, data= [ 0xa8 0x0c ] 3240
            Item(Local ): Usage, data= [ 0x31 ] 49
                            Direction-Y
            Item(Global): Logical Maximum, data= [ 0xa8 0x0c ] 3240
            Item(Main  ): Input, data= [ 0x02 ] 2
                            Data Variable Absolute No_Wrap Linear
                            Preferred_State No_Null_Position Non_Volatile Bitfield
            Item(Global): Usage Page, data= [ 0x0d ] 13
                            Digitizer
            Item(Global): Report Count, data= [ 0x01 ] 1
            Item(Local ): Usage, data= [ 0x48 ] 72
                            Width
            Item(Main  ): Input, data= [ 0x02 ] 2
                            Data Variable Absolute No_Wrap Linear
                            Preferred_State No_Null_Position Non_Volatile Bitfield
            Item(Local ): Usage, data= [ 0x49 ] 73
                            Height
            Item(Main  ): Input, data= [ 0x02 ] 2
                            Data Variable Absolute No_Wrap Linear
                            Preferred_State No_Null_Position Non_Volatile Bitfield
            Item(Main  ): End Collection, data=none
            Item(Global): Usage Page, data= [ 0x0d ] 13
                            Digitizer
            Item(Local ): Usage, data= [ 0x22 ] 34
                            Finger
            Item(Main  ): Collection, data= [ 0x02 ] 2
                            Logical
            Item(Local ): Usage, data= [ 0x42 ] 66
                            Tip Switch
            Item(Global): Logical Minimum, data= [ 0x00 ] 0
            Item(Global): Logical Maximum, data= [ 0x01 ] 1
            Item(Global): Report Size, data= [ 0x01 ] 1
            Item(Global): Report Count, data= [ 0x01 ] 1
            Item(Main  ): Input, data= [ 0x02 ] 2
                            Data Variable Absolute No_Wrap Linear
                            Preferred_State No_Null_Position Non_Volatile Bitfield
            Item(Local ): Usage, data= [ 0x32 ] 50
                            In Range
            Item(Main  ): Input, data= [ 0x02 ] 2
                            Data Variable Absolute No_Wrap Linear
                            Preferred_State No_Null_Position Non_Volatile Bitfield
            Item(Global): Report Count, data= [ 0x06 ] 6
            Item(Main  ): Input, data= [ 0x03 ] 3
                            Constant Variable Absolute No_Wrap Linear
                            Preferred_State No_Null_Position Non_Volatile Bitfield
            Item(Global): Report Size, data= [ 0x08 ] 8
            Item(Local ): Usage, data= [ 0x51 ] 81
                            Contact ID
            Item(Global): Report Count, data= [ 0x01 ] 1
            Item(Main  ): Input, data= [ 0x02 ] 2
                            Data Variable Absolute No_Wrap Linear
                            Preferred_State No_Null_Position Non_Volatile Bitfield
            Item(Global): Usage Page, data= [ 0x01 ] 1
                            Generic Desktop Controls
            Item(Global): Report Size, data= [ 0x10 ] 16
            Item(Global): Report Count, data= [ 0x02 ] 2
            Item(Global): Unit Exponent, data= [ 0x0e ] 14
                            Unit Exponent: 14
            Item(Global): Unit, data= [ 0x11 ] 17
                            System: SI Linear, Unit: Centimeter
            Item(Local ): Usage, data= [ 0x30 ] 48
                            Direction-X
            Item(Global): Logical Maximum, data= [ 0x40 0x14 ] 5184
            Item(Global): Physical Minimum, data= [ 0x00 ] 0
            Item(Global): Physical Maximum, data= [ 0x40 0x14 ] 5184
            Item(Main  ): Input, data= [ 0x02 ] 2
                            Data Variable Absolute No_Wrap Linear
                            Preferred_State No_Null_Position Non_Volatile Bitfield
            Item(Global): Physical Maximum, data= [ 0xa8 0x0c ] 3240
            Item(Local ): Usage, data= [ 0x31 ] 49
                            Direction-Y
            Item(Global): Logical Maximum, data= [ 0xa8 0x0c ] 3240
            Item(Main  ): Input, data= [ 0x02 ] 2
                            Data Variable Absolute No_Wrap Linear
                            Preferred_State No_Null_Position Non_Volatile Bitfield
            Item(Global): Usage Page, data= [ 0x0d ] 13
                            Digitizer
            Item(Global): Report Count, data= [ 0x01 ] 1
            Item(Local ): Usage, data= [ 0x48 ] 72
                            Width
            Item(Main  ): Input, data= [ 0x02 ] 2
                            Data Variable Absolute No_Wrap Linear
                            Preferred_State No_Null_Position Non_Volatile Bitfield
            Item(Local ): Usage, data= [ 0x49 ] 73
                            Height
            Item(Main  ): Input, data= [ 0x02 ] 2
                            Data Variable Absolute No_Wrap Linear
                            Preferred_State No_Null_Position Non_Volatile Bitfield
            Item(Main  ): End Collection, data=none
            Item(Global): Usage Page, data= [ 0x0d ] 13
                            Digitizer
            Item(Local ): Usage, data= [ 0x22 ] 34
                            Finger
            Item(Main  ): Collection, data= [ 0x02 ] 2
                            Logical
            Item(Local ): Usage, data= [ 0x42 ] 66
                            Tip Switch
            Item(Global): Logical Minimum, data= [ 0x00 ] 0
            Item(Global): Logical Maximum, data= [ 0x01 ] 1
            Item(Global): Report Size, data= [ 0x01 ] 1
            Item(Global): Report Count, data= [ 0x01 ] 1
            Item(Main  ): Input, data= [ 0x02 ] 2
                            Data Variable Absolute No_Wrap Linear
                            Preferred_State No_Null_Position Non_Volatile Bitfield
            Item(Local ): Usage, data= [ 0x32 ] 50
                            In Range
            Item(Main  ): Input, data= [ 0x02 ] 2
                            Data Variable Absolute No_Wrap Linear
                            Preferred_State No_Null_Position Non_Volatile Bitfield
            Item(Global): Report Count, data= [ 0x06 ] 6
            Item(Main  ): Input, data= [ 0x03 ] 3
                            Constant Variable Absolute No_Wrap Linear
                            Preferred_State No_Null_Position Non_Volatile Bitfield
            Item(Global): Report Size, data= [ 0x08 ] 8
            Item(Local ): Usage, data= [ 0x51 ] 81
                            Contact ID
            Item(Global): Report Count, data= [ 0x01 ] 1
            Item(Main  ): Input, data= [ 0x02 ] 2
                            Data Variable Absolute No_Wrap Linear
                            Preferred_State No_Null_Position Non_Volatile Bitfield
            Item(Global): Usage Page, data= [ 0x01 ] 1
                            Generic Desktop Controls
            Item(Global): Report Size, data= [ 0x10 ] 16
            Item(Global): Report Count, data= [ 0x02 ] 2
            Item(Global): Unit Exponent, data= [ 0x0e ] 14
                            Unit Exponent: 14
            Item(Global): Unit, data= [ 0x11 ] 17
                            System: SI Linear, Unit: Centimeter
            Item(Local ): Usage, data= [ 0x30 ] 48
                            Direction-X
            Item(Global): Logical Maximum, data= [ 0x40 0x14 ] 5184
            Item(Global): Physical Minimum, data= [ 0x00 ] 0
            Item(Global): Physical Maximum, data= [ 0x40 0x14 ] 5184
            Item(Main  ): Input, data= [ 0x02 ] 2
                            Data Variable Absolute No_Wrap Linear
                            Preferred_State No_Null_Position Non_Volatile Bitfield
            Item(Global): Physical Maximum, data= [ 0xa8 0x0c ] 3240
            Item(Local ): Usage, data= [ 0x31 ] 49
                            Direction-Y
            Item(Global): Logical Maximum, data= [ 0xa8 0x0c ] 3240
            Item(Main  ): Input, data= [ 0x02 ] 2
                            Data Variable Absolute No_Wrap Linear
                            Preferred_State No_Null_Position Non_Volatile Bitfield
            Item(Global): Usage Page, data= [ 0x0d ] 13
                            Digitizer
            Item(Global): Report Count, data= [ 0x01 ] 1
            Item(Local ): Usage, data= [ 0x48 ] 72
                            Width
            Item(Main  ): Input, data= [ 0x02 ] 2
                            Data Variable Absolute No_Wrap Linear
                            Preferred_State No_Null_Position Non_Volatile Bitfield
            Item(Local ): Usage, data= [ 0x49 ] 73
                            Height
            Item(Main  ): Input, data= [ 0x02 ] 2
                            Data Variable Absolute No_Wrap Linear
                            Preferred_State No_Null_Position Non_Volatile Bitfield
            Item(Main  ): End Collection, data=none
            Item(Global): Usage Page, data= [ 0x0d ] 13
                            Digitizer
            Item(Global): Logical Maximum, data= [ 0xff 0xff 0xff 0x0f ] 268435455
            Item(Global): Report Size, data= [ 0x20 ] 32
            Item(Global): Report Count, data= [ 0x01 ] 1
            Item(Local ): Usage, data= [ 0x56 ] 86
                            (null)
            Item(Main  ): Input, data= [ 0x02 ] 2
                            Data Variable Absolute No_Wrap Linear
                            Preferred_State No_Null_Position Non_Volatile Bitfield
            Item(Local ): Usage, data= [ 0x54 ] 84
                            Contact Count
            Item(Global): Logical Maximum, data= [ 0xff 0x00 ] 255
            Item(Global): Report Count, data= [ 0x01 ] 1
            Item(Global): Report Size, data= [ 0x08 ] 8
            Item(Main  ): Input, data= [ 0x02 ] 2
                            Data Variable Absolute No_Wrap Linear
                            Preferred_State No_Null_Position Non_Volatile Bitfield
            Item(Global): Report ID, data= [ 0x10 ] 16
            Item(Local ): Usage, data= [ 0x55 ] 85
                            Maximum Contact Number
            Item(Global): Report Count, data= [ 0x02 ] 2
            Item(Global): Logical Maximum, data= [ 0x0a ] 10
            Item(Main  ): Feature, data= [ 0x02 ] 2
                            Data Variable Absolute No_Wrap Linear
                            Preferred_State No_Null_Position Non_Volatile Bitfield
            Item(Global): Report ID, data= [ 0x11 ] 17
            Item(Global): Usage Page, data= [ 0x00 0xff ] 65280
                            (null)
            Item(Local ): Usage, data= [ 0xc5 ] 197
                            (null)
            Item(Global): Report Count, data= [ 0x00 0x01 ] 256
            Item(Main  ): Feature, data= [ 0x02 ] 2
                            Data Variable Absolute No_Wrap Linear
                            Preferred_State No_Null_Position Non_Volatile Bitfield
            Item(Main  ): End Collection, data=none
            Item(Global): Usage Page, data= [ 0x0d ] 13
                            Digitizer
            Item(Local ): Usage, data= [ 0x0e ] 14
                            (null)
            Item(Main  ): Collection, data= [ 0x01 ] 1
                            Application
            Item(Global): Report ID, data= [ 0x12 ] 18
            Item(Local ): Usage, data= [ 0x23 ] 35
                            (null)
            Item(Main  ): Collection, data= [ 0x02 ] 2
                            Logical
            Item(Local ): Usage, data= [ 0x52 ] 82
                            Input Mode
            Item(Local ): Usage, data= [ 0x53 ] 83
                            Device Index
            Item(Global): Logical Minimum, data= [ 0x00 ] 0
            Item(Global): Logical Maximum, data= [ 0x0a ] 10
            Item(Global): Report Size, data= [ 0x08 ] 8
            Item(Global): Report Count, data= [ 0x02 ] 2
            Item(Main  ): Feature, data= [ 0x02 ] 2
                            Data Variable Absolute No_Wrap Linear
                            Preferred_State No_Null_Position Non_Volatile Bitfield
            Item(Main  ): End Collection, data=none
            Item(Main  ): End Collection, data=none
            Item(Global): Usage Page, data= [ 0x0d ] 13
                            Digitizer
            Item(Local ): Usage, data= [ 0x04 ] 4
                            Touch Screen
            Item(Main  ): Collection, data= [ 0x01 ] 1
                            Application
            Item(Global): Report ID, data= [ 0x02 ] 2
            Item(Local ): Usage, data= [ 0x22 ] 34
                            Finger
            Item(Main  ): Collection, data= [ 0x02 ] 2
                            Logical
            Item(Local ): Usage, data= [ 0x42 ] 66
                            Tip Switch
            Item(Global): Logical Minimum, data= [ 0x00 ] 0
            Item(Global): Logical Maximum, data= [ 0x01 ] 1
            Item(Global): Report Size, data= [ 0x01 ] 1
            Item(Global): Report Count, data= [ 0x01 ] 1
            Item(Main  ): Input, data= [ 0x02 ] 2
                            Data Variable Absolute No_Wrap Linear
                            Preferred_State No_Null_Position Non_Volatile Bitfield
            Item(Local ): Usage, data= [ 0x32 ] 50
                            In Range
            Item(Main  ): Input, data= [ 0x02 ] 2
                            Data Variable Absolute No_Wrap Linear
                            Preferred_State No_Null_Position Non_Volatile Bitfield
            Item(Global): Report Count, data= [ 0x06 ] 6
            Item(Main  ): Input, data= [ 0x03 ] 3
                            Constant Variable Absolute No_Wrap Linear
                            Preferred_State No_Null_Position Non_Volatile Bitfield
            Item(Global): Report Size, data= [ 0x08 ] 8
            Item(Local ): Usage, data= [ 0x51 ] 81
                            Contact ID
            Item(Global): Report Count, data= [ 0x01 ] 1
            Item(Main  ): Input, data= [ 0x02 ] 2
                            Data Variable Absolute No_Wrap Linear
                            Preferred_State No_Null_Position Non_Volatile Bitfield
            Item(Global): Usage Page, data= [ 0x01 ] 1
                            Generic Desktop Controls
            Item(Global): Report Size, data= [ 0x10 ] 16
            Item(Global): Report Count, data= [ 0x02 ] 2
            Item(Global): Unit Exponent, data= [ 0x0e ] 14
                            Unit Exponent: 14
            Item(Global): Unit, data= [ 0x11 ] 17
                            System: SI Linear, Unit: Centimeter
            Item(Local ): Usage, data= [ 0x30 ] 48
                            Direction-X
            Item(Global): Logical Maximum, data= [ 0x40 0x14 ] 5184
            Item(Global): Physical Minimum, data= [ 0x00 ] 0
            Item(Global): Physical Maximum, data= [ 0x40 0x14 ] 5184
            Item(Main  ): Input, data= [ 0x02 ] 2
                            Data Variable Absolute No_Wrap Linear
                            Preferred_State No_Null_Position Non_Volatile Bitfield
            Item(Global): Physical Maximum, data= [ 0xa8 0x0c ] 3240
            Item(Local ): Usage, data= [ 0x31 ] 49
                            Direction-Y
            Item(Global): Logical Maximum, data= [ 0xa8 0x0c ] 3240
            Item(Main  ): Input, data= [ 0x02 ] 2
                            Data Variable Absolute No_Wrap Linear
                            Preferred_State No_Null_Position Non_Volatile Bitfield
            Item(Global): Usage Page, data= [ 0x0d ] 13
                            Digitizer
            Item(Global): Report Count, data= [ 0x01 ] 1
            Item(Local ): Usage, data= [ 0x48 ] 72
                            Width
            Item(Main  ): Input, data= [ 0x02 ] 2
                            Data Variable Absolute No_Wrap Linear
                            Preferred_State No_Null_Position Non_Volatile Bitfield
            Item(Local ): Usage, data= [ 0x49 ] 73
                            Height
            Item(Main  ): Input, data= [ 0x02 ] 2
                            Data Variable Absolute No_Wrap Linear
                            Preferred_State No_Null_Position Non_Volatile Bitfield
            Item(Main  ): End Collection, data=none
            Item(Global): Usage Page, data= [ 0x0d ] 13
                            Digitizer
            Item(Global): Logical Maximum, data= [ 0xff 0xff 0xff 0x0f ] 268435455
            Item(Global): Report Size, data= [ 0x20 ] 32
            Item(Global): Report Count, data= [ 0x01 ] 1
            Item(Local ): Usage, data= [ 0x56 ] 86
                            (null)
            Item(Main  ): Input, data= [ 0x02 ] 2
                            Data Variable Absolute No_Wrap Linear
                            Preferred_State No_Null_Position Non_Volatile Bitfield
            Item(Main  ): End Collection, data=none
            Item(Global): Usage Page, data= [ 0x01 ] 1
                            Generic Desktop Controls
            Item(Local ): Usage, data= [ 0x02 ] 2
                            Mouse
            Item(Main  ): Collection, data= [ 0x01 ] 1
                            Application
            Item(Global): Report ID, data= [ 0x03 ] 3
            Item(Local ): Usage, data= [ 0x01 ] 1
                            Pointer
            Item(Main  ): Collection, data= [ 0x00 ] 0
                            Physical
            Item(Global): Usage Page, data= [ 0x09 ] 9
                            Buttons
            Item(Local ): Usage Minimum, data= [ 0x01 ] 1
                            Button 1 (Primary)
            Item(Local ): Usage Maximum, data= [ 0x02 ] 2
                            Button 2 (Secondary)
            Item(Global): Logical Minimum, data= [ 0x00 ] 0
            Item(Global): Logical Maximum, data= [ 0x01 ] 1
            Item(Global): Report Count, data= [ 0x02 ] 2
            Item(Global): Report Size, data= [ 0x01 ] 1
            Item(Main  ): Input, data= [ 0x02 ] 2
                            Data Variable Absolute No_Wrap Linear
                            Preferred_State No_Null_Position Non_Volatile Bitfield
            Item(Global): Report Count, data= [ 0x01 ] 1
            Item(Global): Report Size, data= [ 0x06 ] 6
            Item(Main  ): Input, data= [ 0x03 ] 3
                            Constant Variable Absolute No_Wrap Linear
                            Preferred_State No_Null_Position Non_Volatile Bitfield
            Item(Global): Usage Page, data= [ 0x01 ] 1
                            Generic Desktop Controls
            Item(Global): Report Size, data= [ 0x10 ] 16
            Item(Global): Report Count, data= [ 0x01 ] 1
            Item(Global): Unit Exponent, data= [ 0x0e ] 14
                            Unit Exponent: 14
            Item(Global): Unit, data= [ 0x11 ] 17
                            System: SI Linear, Unit: Centimeter
            Item(Local ): Usage, data= [ 0x30 ] 48
                            Direction-X
            Item(Global): Logical Maximum, data= [ 0x40 0x14 ] 5184
            Item(Global): Physical Minimum, data= [ 0x00 ] 0
            Item(Global): Physical Maximum, data= [ 0x40 0x14 ] 5184
            Item(Main  ): Input, data= [ 0x02 ] 2
                            Data Variable Absolute No_Wrap Linear
                            Preferred_State No_Null_Position Non_Volatile Bitfield
            Item(Global): Physical Maximum, data= [ 0xa8 0x0c ] 3240
            Item(Local ): Usage, data= [ 0x31 ] 49
                            Direction-Y
            Item(Global): Logical Maximum, data= [ 0xa8 0x0c ] 3240
            Item(Main  ): Input, data= [ 0x02 ] 2
                            Data Variable Absolute No_Wrap Linear
                            Preferred_State No_Null_Position Non_Volatile Bitfield
            Item(Main  ): End Collection, data=none
            Item(Main  ): End Collection, data=none
      Endpoint Descriptor:
        bLength                 7
        bDescriptorType         5
        bEndpointAddress     0x83  EP 3 IN
        bmAttributes            3
          Transfer Type            Interrupt
          Synch Type               None
          Usage Type               Data
        wMaxPacketSize     0x0040  1x 64 bytes
        bInterval               3
Device Status:     0x0001
  Self Powered

Bus 003 Device 006: ID 056a:00f8 Wacom Co., Ltd 
Device Descriptor:
  bLength                18
  bDescriptorType         1
  bcdUSB               2.00
  bDeviceClass            0 (Defined at Interface level)
  bDeviceSubClass         0 
  bDeviceProtocol         0 
  bMaxPacketSize0        16
  idVendor           0x056a Wacom Co., Ltd
  idProduct          0x00f8 
  bcdDevice            2.07
  iManufacturer           1 Tablet
  iProduct                2 Cintiq 24HDT Tablet
  iSerial                 0 
  bNumConfigurations      1
  Configuration Descriptor:
    bLength                 9
    bDescriptorType         2
    wTotalLength           34
    bNumInterfaces          1
    bConfigurationValue     1
    iConfiguration          0 
    bmAttributes         0xe0
      Self Powered
      Remote Wakeup
    MaxPower                0mA
    Interface Descriptor:
      bLength                 9
      bDescriptorType         4
      bInterfaceNumber        0
      bAlternateSetting       0
      bNumEndpoints           1
      bInterfaceClass         3 Human Interface Device
      bInterfaceSubClass      1 Boot Interface Subclass
      bInterfaceProtocol      2 Mouse
      iInterface              0 
        HID Device Descriptor:
          bLength                 9
          bDescriptorType        33
          bcdHID               1.10
          bCountryCode            0 Not supported
          bNumDescriptors         1
          bDescriptorType        34 Report
          wDescriptorLength     211
          Report Descriptor: (length is 211)
            Item(Global): Usage Page, data= [ 0x01 ] 1
                            Generic Desktop Controls
            Item(Local ): Usage, data= [ 0x02 ] 2
                            Mouse
            Item(Main  ): Collection, data= [ 0x01 ] 1
                            Application
            Item(Global): Report ID, data= [ 0x01 ] 1
            Item(Local ): Usage, data= [ 0x01 ] 1
                            Pointer
            Item(Main  ): Collection, data= [ 0x00 ] 0
                            Physical
            Item(Global): Usage Page, data= [ 0x09 ] 9
                            Buttons
            Item(Local ): Usage Minimum, data= [ 0x01 ] 1
                            Button 1 (Primary)
            Item(Local ): Usage Maximum, data= [ 0x03 ] 3
                            Button 3 (Tertiary)
            Item(Global): Logical Minimum, data= [ 0x00 ] 0
            Item(Global): Logical Maximum, data= [ 0x01 ] 1
            Item(Global): Report Count, data= [ 0x03 ] 3
            Item(Global): Report Size, data= [ 0x01 ] 1
            Item(Main  ): Input, data= [ 0x02 ] 2
                            Data Variable Absolute No_Wrap Linear
                            Preferred_State No_Null_Position Non_Volatile Bitfield
            Item(Global): Report Count, data= [ 0x05 ] 5
            Item(Main  ): Input, data= [ 0x03 ] 3
                            Constant Variable Absolute No_Wrap Linear
                            Preferred_State No_Null_Position Non_Volatile Bitfield
            Item(Global): Usage Page, data= [ 0x01 ] 1
                            Generic Desktop Controls
            Item(Local ): Usage, data= [ 0x30 ] 48
                            Direction-X
            Item(Local ): Usage, data= [ 0x31 ] 49
                            Direction-Y
            Item(Local ): Usage, data= [ 0x38 ] 56
                            Wheel
            Item(Global): Logical Minimum, data= [ 0x81 ] 129
            Item(Global): Logical Maximum, data= [ 0x7f ] 127
            Item(Global): Report Size, data= [ 0x08 ] 8
            Item(Global): Report Count, data= [ 0x03 ] 3
            Item(Main  ): Input, data= [ 0x06 ] 6
                            Data Variable Relative No_Wrap Linear
                            Preferred_State No_Null_Position Non_Volatile Bitfield
            Item(Main  ): End Collection, data=none
            Item(Main  ): End Collection, data=none
            Item(Global): Usage Page, data= [ 0x0d ] 13
                            Digitizer
            Item(Local ): Usage, data= [ 0x01 ] 1
                            Digitizer
            Item(Main  ): Collection, data= [ 0x01 ] 1
                            Application
            Item(Global): Report ID, data= [ 0x02 ] 2
            Item(Local ): Usage, data= [ 0x00 ] 0
                            Undefined
            Item(Global): Report Size, data= [ 0x08 ] 8
            Item(Global): Report Count, data= [ 0x09 0x00 ] 9
            Item(Global): Logical Minimum, data= [ 0x00 ] 0
            Item(Global): Logical Maximum, data= [ 0xff 0x00 ] 255
            Item(Main  ): Input, data= [ 0x02 ] 2
                            Data Variable Absolute No_Wrap Linear
                            Preferred_State No_Null_Position Non_Volatile Bitfield
            Item(Global): Report ID, data= [ 0x0c ] 12
            Item(Local ): Usage, data= [ 0x00 ] 0
                            Undefined
            Item(Global): Report Size, data= [ 0x08 ] 8
            Item(Global): Report Count, data= [ 0x09 0x00 ] 9
            Item(Global): Logical Minimum, data= [ 0x00 ] 0
            Item(Global): Logical Maximum, data= [ 0xff 0x00 ] 255
            Item(Main  ): Input, data= [ 0x02 ] 2
                            Data Variable Absolute No_Wrap Linear
                            Preferred_State No_Null_Position Non_Volatile Bitfield
            Item(Global): Report ID, data= [ 0x02 ] 2
            Item(Local ): Usage, data= [ 0x00 ] 0
                            Undefined
            Item(Global): Report Count, data= [ 0x01 ] 1
            Item(Main  ): Feature, data= [ 0x02 ] 2
                            Data Variable Absolute No_Wrap Linear
                            Preferred_State No_Null_Position Non_Volatile Bitfield
            Item(Global): Report ID, data= [ 0x03 ] 3
            Item(Local ): Usage, data= [ 0x00 ] 0
                            Undefined
            Item(Global): Report Count, data= [ 0x01 ] 1
            Item(Main  ): Feature, data= [ 0x02 ] 2
                            Data Variable Absolute No_Wrap Linear
                            Preferred_State No_Null_Position Non_Volatile Bitfield
            Item(Global): Report ID, data= [ 0x05 ] 5
            Item(Local ): Usage, data= [ 0x00 ] 0
                            Undefined
            Item(Global): Report Count, data= [ 0x08 ] 8
            Item(Main  ): Feature, data= [ 0x02 ] 2
                            Data Variable Absolute No_Wrap Linear
                            Preferred_State No_Null_Position Non_Volatile Bitfield
            Item(Global): Report ID, data= [ 0x07 ] 7
            Item(Local ): Usage, data= [ 0x00 ] 0
                            Undefined
            Item(Global): Report Count, data= [ 0x06 ] 6
            Item(Main  ): Feature, data= [ 0x02 ] 2
                            Data Variable Absolute No_Wrap Linear
                            Preferred_State No_Null_Position Non_Volatile Bitfield
            Item(Global): Report ID, data= [ 0x08 ] 8
            Item(Local ): Usage, data= [ 0x00 ] 0
                            Undefined
            Item(Global): Report Count, data= [ 0x04 ] 4
            Item(Main  ): Feature, data= [ 0x02 ] 2
                            Data Variable Absolute No_Wrap Linear
                            Preferred_State No_Null_Position Non_Volatile Bitfield
            Item(Global): Report ID, data= [ 0x0a ] 10
            Item(Local ): Usage, data= [ 0x00 ] 0
                            Undefined
            Item(Global): Report Count, data= [ 0x02 ] 2
            Item(Main  ): Feature, data= [ 0x02 ] 2
                            Data Variable Absolute No_Wrap Linear
                            Preferred_State No_Null_Position Non_Volatile Bitfield
            Item(Global): Report ID, data= [ 0x0b ] 11
            Item(Local ): Usage, data= [ 0x00 ] 0
                            Undefined
            Item(Global): Report Count, data= [ 0x01 ] 1
            Item(Main  ): Feature, data= [ 0x02 ] 2
                            Data Variable Absolute No_Wrap Linear
                            Preferred_State No_Null_Position Non_Volatile Bitfield
            Item(Global): Report ID, data= [ 0x10 ] 16
            Item(Local ): Usage, data= [ 0x00 ] 0
                            Undefined
            Item(Global): Report Count, data= [ 0x05 ] 5
            Item(Main  ): Feature, data= [ 0x02 ] 2
                            Data Variable Absolute No_Wrap Linear
                            Preferred_State No_Null_Position Non_Volatile Bitfield
            Item(Global): Report ID, data= [ 0x20 ] 32
            Item(Local ): Usage, data= [ 0x00 ] 0
                            Undefined
            Item(Global): Report Count, data= [ 0x08 ] 8
            Item(Main  ): Feature, data= [ 0x02 ] 2
                            Data Variable Absolute No_Wrap Linear
                            Preferred_State No_Null_Position Non_Volatile Bitfield
            Item(Global): Report ID, data= [ 0x04 ] 4
            Item(Local ): Usage, data= [ 0x00 ] 0
                            Undefined
            Item(Global): Report Count, data= [ 0x01 ] 1
            Item(Main  ): Feature, data= [ 0x02 ] 2
                            Data Variable Absolute No_Wrap Linear
                            Preferred_State No_Null_Position Non_Volatile Bitfield
            Item(Global): Report ID, data= [ 0x0d ] 13
            Item(Local ): Usage, data= [ 0x00 ] 0
                            Undefined
            Item(Global): Report Count, data= [ 0x01 ] 1
            Item(Main  ): Feature, data= [ 0x02 ] 2
                            Data Variable Absolute No_Wrap Linear
                            Preferred_State No_Null_Position Non_Volatile Bitfield
            Item(Global): Report ID, data= [ 0x11 ] 17
            Item(Local ): Usage, data= [ 0x00 ] 0
                            Undefined
            Item(Global): Report Count, data= [ 0x01 ] 1
            Item(Main  ): Feature, data= [ 0x02 ] 2
                            Data Variable Absolute No_Wrap Linear
                            Preferred_State No_Null_Position Non_Volatile Bitfield
            Item(Global): Report ID, data= [ 0x12 ] 18
            Item(Local ): Usage, data= [ 0x00 ] 0
                            Undefined
            Item(Global): Report Count, data= [ 0x02 ] 2
            Item(Main  ): Feature, data= [ 0x02 ] 2
                            Data Variable Absolute No_Wrap Linear
                            Preferred_State No_Null_Position Non_Volatile Bitfield
            Item(Global): Report ID, data= [ 0x30 ] 48
            Item(Local ): Usage, data= [ 0x00 ] 0
                            Undefined
            Item(Global): Report Count, data= [ 0x01 ] 1
            Item(Main  ): Feature, data= [ 0x02 ] 2
                            Data Variable Absolute No_Wrap Linear
                            Preferred_State No_Null_Position Non_Volatile Bitfield
            Item(Global): Report ID, data= [ 0xcc ] 204
            Item(Local ): Usage, data= [ 0x00 ] 0
                            Undefined
            Item(Global): Report Count, data= [ 0x02 ] 2
            Item(Main  ): Feature, data= [ 0x02 ] 2
                            Data Variable Absolute No_Wrap Linear
                            Preferred_State No_Null_Position Non_Volatile Bitfield
            Item(Main  ): End Collection, data=none
      Endpoint Descriptor:
        bLength                 7
        bDescriptorType         5
        bEndpointAddress     0x82  EP 2 IN
        bmAttributes            3
          Transfer Type            Interrupt
          Synch Type               None
          Usage Type               Data
        wMaxPacketSize     0x000a  1x 10 bytes
        bInterval               1
Device Status:     0x0001
  Self Powered
