D: 0
R: 110 05 01 09 02 a1 01 85 01 09 01 a1 00 05 09 19 01 29 03 15 00 25 01 95 03 75 01 81 02 95 01 75 05 81 01 05 01 09 30 09 31 09 38 15 81 25 7f 75 08 95 03 81 06 95 03 81 01 c0 c0 05 0d 09 01 a1 01 85 02 a1 00 06 00 ff 09 01 15 00 26 ff 00 75 08 95 07 81 02 c0 09 01 85 63 95 07 81 02 09 01 85 02 95 01 b1 02 09 01 85 03 95 01 b1 02 c0
N: WACOM FT-0203-UV1.4-2
P: usb-0000:00:1d.0-1.8/input0
I: 3 056a 0061
D: 0
E: 0.000000 8 63 00 00 00 00 00 00 00
E: 0.007978 8 63 00 00 00 00 00 00 00
E: 0.015975 8 63 00 00 00 00 00 00 00
E: 0.023978 8 63 00 00 00 00 00 00 00
E: 0.031981 8 63 00 00 00 00 00 00 00
E: 0.039998 8 63 00 00 00 00 00 00 00
E: 0.047984 8 63 00 00 00 00 00 00 00
E: 0.055977 8 63 00 00 00 00 00 00 00
E: 0.067830 8 02 90 e0 04 4c 04 00 00
E: 0.071981 8 02 90 d8 04 33 04 00 00
E: 0.087998 8 02 90 cc 04 05 04 01 00
E: 0.095996 8 02 90 c3 04 e0 03 00 00
E: 0.103981 8 02 90 bc 04 c7 03 00 00
E: 0.111982 8 02 90 b7 04 b9 03 06 00
E: 0.119974 8 63 00 00 00 00 00 00 00
E: 0.128090 8 02 90 b3 04 98 03 00 00
E: 0.136047 8 02 90 af 04 89 03 04 00
E: 0.143998 8 02 90 b0 04 76 03 00 00
E: 0.151979 8 02 90 af 04 73 03 01 00
E: 0.159980 8 63 00 00 00 00 00 00 00
E: 0.167996 8 02 90 b6 04 66 03 00 00
E: 0.175984 8 02 90 b6 04 5e 03 00 00
E: 0.183991 8 02 90 b7 04 56 03 00 00
E: 0.200002 8 02 90 b6 04 4f 03 00 00
E: 0.207996 8 02 90 b1 04 42 03 00 00
E: 0.216431 8 02 90 ab 04 3c 03 00 00
E: 0.224455 8 02 90 a6 04 2c 03 00 00
E: 0.231978 8 63 00 00 00 00 00 00 00
E: 0.240399 8 02 90 a0 04 22 03 01 00
E: 0.248482 8 02 90 a1 04 17 03 00 00
E: 0.256505 8 02 90 a2 04 0c 03 00 00
E: 0.272775 8 02 90 a2 04 fe 02 00 00
E: 0.280549 8 02 90 a0 04 f3 02 00 00
E: 0.288598 8 02 90 99 04 ec 02 00 00
E: 0.296702 8 02 90 8e 04 db 02 01 00
E: 0.303981 8 63 00 00 00 00 00 00 00
E: 0.312499 8 02 90 89 04 cc 02 00 00
E: 0.320631 8 02 90 84 04 bd 02 00 00
E: 0.328490 8 02 90 81 04 b4 02 00 00
E: 0.344994 8 02 90 7e 04 a9 02 00 00
E: 0.352680 8 02 90 7c 04 a2 02 01 00
E: 0.360615 8 02 90 77 04 96 02 01 00
E: 0.368516 8 02 90 73 04 8e 02 00 00
E: 0.376008 8 63 00 00 00 00 00 00 00
E: 0.384687 8 02 90 70 04 85 02 00 00
E: 0.392771 8 02 90 6b 04 7c 02 00 00
E: 0.400715 8 02 90 67 04 71 02 00 00
E: 0.408529 8 02 90 5d 04 67 02 00 00
E: 0.415991 8 63 00 00 00 00 00 00 00
E: 0.424791 8 02 90 57 04 5f 02 00 00
E: 0.432594 8 02 90 55 04 56 02 01 00
E: 0.440731 8 02 90 56 04 50 02 00 00
E: 0.456613 8 02 90 57 04 50 02 00 00
E: 0.464474 8 02 90 56 04 4f 02 00 00
E: 0.475742 8 02 90 56 04 50 02 08 00
E: 0.479997 8 02 90 56 04 50 02 08 00
E: 0.488000 8 63 00 00 00 00 00 00 00
E: 0.496027 8 02 90 57 04 51 02 14 00
E: 0.503980 8 02 90 58 04 52 02 13 00
E: 0.512392 8 02 90 5a 04 56 02 20 00
E: 0.527987 8 02 90 5b 04 62 02 26 00
E: 0.535979 8 02 90 5e 04 69 02 2a 00
E: 0.544758 8 02 90 67 04 7a 02 30 00
E: 0.552564 8 02 90 73 04 8c 02 37 00
E: 0.559984 8 63 00 00 00 00 00 00 00
E: 0.569347 8 02 90 88 04 a7 02 38 00
E: 0.578620 8 02 91 9d 04 c6 02 40 00
E: 0.584612 8 02 91 bc 04 f0 02 3b 00
E: 0.601594 8 02 91 e5 04 20 03 3f 00
E: 0.610452 8 02 91 18 05 57 03 3e 00
E: 0.617232 8 02 91 55 05 96 03 41 00
E: 0.624777 8 02 91 96 05 dc 03 3e 00
E: 0.640026 8 02 91 d0 05 20 04 43 00
E: 0.647994 8 02 91 0b 06 75 04 4a 00
E: 0.655989 8 02 91 48 06 c7 04 4c 00
E: 0.664028 8 02 91 71 06 0c 05 49 00
E: 0.671988 8 63 00 00 00 00 00 00 00
E: 0.680474 8 02 91 95 06 40 05 4e 00
E: 0.690872 8 02 91 ab 06 68 05 54 00
E: 0.697206 8 02 91 b1 06 7f 05 56 00
E: 0.713290 8 02 91 b9 06 91 05 5c 00
E: 0.721055 8 02 91 b8 06 a0 05 63 00
E: 0.728448 8 02 91 b9 06 a4 05 5d 00
E: 0.736789 8 02 91 b7 06 a8 05 46 00
E: 0.744842 8 63 00 00 00 00 00 00 00
E: 0.752508 8 02 90 b7 06 a9 05 2e 00
E: 0.760396 8 02 90 b7 06 a8 05 15 00
E: 0.770328 8 02 90 b6 06 ab 05 00 00
E: 0.783985 8 02 90 b8 06 a9 05 00 00
E: 0.792000 8 02 90 c1 06 9b 05 00 00
E: 0.800009 8 02 90 c8 06 8d 05 00 00
E: 0.809759 8 02 90 c8 06 7e 05 00 00
E: 0.815974 8 63 00 00 00 00 00 00 00
E: 0.826128 8 02 90 cb 06 70 05 00 00
E: 0.833037 8 02 90 c8 06 53 05 00 00
E: 0.841071 8 02 90 bd 06 31 05 00 00
E: 0.857168 8 02 90 b7 06 11 05 00 00
E: 0.865181 8 02 90 a5 06 ea 04 00 00
E: 0.874117 8 02 90 a3 06 bd 04 00 00
E: 0.880357 8 02 90 9c 06 92 04 00 00
E: 0.896365 8 02 90 a0 06 5c 04 00 00
E: 0.904315 8 02 90 a2 06 30 04 00 00
E: 0.912901 8 02 90 ac 06 04 04 00 00
E: 0.920168 8 02 90 c7 06 d6 03 00 00
E: 0.928223 8 63 00 00 00 00 00 00 00
E: 0.938624 8 02 90 e0 06 ad 03 00 00
E: 0.945105 8 02 90 fe 06 82 03 01 00
E: 0.953007 8 02 90 1e 07 50 03 00 00
E: 0.968193 8 02 90 3d 07 21 03 01 00
E: 0.976204 8 02 90 53 07 e9 02 00 00
E: 0.984185 8 02 90 69 07 af 02 00 00
E: 0.992166 8 02 90 76 07 76 02 00 00
E: 0.999966 8 63 00 00 00 00 00 00 00
E: 1.008235 8 02 90 75 07 49 02 00 00
E: 1.017532 8 02 90 78 07 2f 02 00 00
E: 1.026964 8 02 90 78 07 1b 02 01 00
E: 1.040945 8 02 90 74 07 0e 02 00 00
E: 1.049151 8 02 90 73 07 04 02 01 00
E: 1.057234 8 02 90 74 07 0b 02 01 00
E: 1.065021 8 02 90 71 07 03 02 01 00
E: 1.072365 8 63 00 00 00 00 00 00 00
E: 1.080084 8 02 90 6c 07 05 02 00 00
E: 1.090433 8 02 90 64 07 00 02 00 00
E: 1.097119 8 02 90 5f 07 01 02 01 00
E: 1.113028 8 02 90 5c 07 00 02 00 00
E: 1.124140 8 02 90 56 07 03 02 01 00
E: 1.127956 8 02 90 56 07 04 02 01 00
E: 1.138607 8 02 90 55 07 07 02 01 00
E: 1.156201 8 02 90 54 07 0e 02 00 00
E: 1.159970 8 02 90 4f 07 12 02 01 00
E: 1.169025 8 02 90 49 07 1d 02 01 00
E: 1.181410 8 02 90 42 07 25 02 06 00
E: 1.183958 8 63 00 00 00 00 00 00 00
E: 1.191965 8 02 90 36 07 30 02 07 00
E: 1.199963 8 02 90 1c 07 45 02 0d 00
E: 1.207989 8 02 90 02 07 62 02 11 00
E: 1.223971 8 02 90 dc 06 90 02 18 00
E: 1.231962 8 02 90 af 06 cc 02 1c 00
E: 1.239973 8 02 90 76 06 1e 03 21 00
E: 1.247974 8 02 90 33 06 81 03 12 00
E: 1.255956 8 63 00 00 00 00 00 00 00
E: 1.263969 8 02 90 dc 05 ef 03 0d 00
E: 1.271967 8 02 90 86 05 50 04 12 00
E: 1.279976 8 02 90 30 05 a5 04 22 00
E: 1.298689 8 02 90 dd 04 fb 04 27 00
E: 1.305290 8 02 90 9c 04 3e 05 21 00
E: 1.311966 8 02 90 71 04 70 05 28 00
E: 1.320156 8 02 90 51 04 93 05 26 00
E: 1.327960 8 63 00 00 00 00 00 00 00
E: 1.337311 8 02 90 40 04 a9 05 2d 00
E: 1.344200 8 02 90 3c 04 b1 05 30 00
E: 1.351970 8 02 90 38 04 b5 05 32 00
E: 1.368211 8 02 91 37 04 b9 05 40 00
E: 1.376174 8 02 91 35 04 b9 05 53 00
E: 1.384168 8 02 91 35 04 b9 05 5c 00
E: 1.392249 8 02 91 36 04 b8 05 60 00
E: 1.408270 8 02 91 36 04 b3 05 5c 00
E: 1.416190 8 02 90 38 04 a8 05 09 00
E: 1.424656 8 02 90 40 04 98 05 00 00
E: 1.432168 8 02 90 43 04 86 05 00 00
E: 1.439960 8 63 00 00 00 00 00 00 00
E: 1.447972 8 02 90 4d 04 70 05 00 00
E: 1.455965 8 02 90 56 04 61 05 00 00
E: 1.464165 8 02 90 58 04 4e 05 00 00
E: 1.480225 8 02 90 54 04 38 05 01 00
E: 1.488209 8 02 90 53 04 1d 05 00 00
E: 1.496173 8 02 90 4a 04 05 05 00 00
E: 1.504197 8 02 90 3b 04 dd 04 00 00
E: 1.511967 8 63 00 00 00 00 00 00 00
E: 1.520204 8 02 10 32 04 b7 04 00 00
E: 1.527965 8 02 10 07 04 8b 04 00 00
E: 1.535968 8 02 10 e6 03 46 04 00 00
E: 1.551969 8 02 10 bc 03 03 04 00 00
E: 1.559999 8 02 10 a0 03 84 03 00 00
E: 1.567967 8 02 10 a0 03 34 03 00 00
E: 1.583971 8 02 00 00 00 00 00 00 00
E: 6.367922 8 63 00 00 00 00 00 00 00
E: 6.375919 8 63 00 00 00 00 00 00 00
E: 6.383917 8 63 00 00 00 00 00 00 00
E: 6.391910 8 63 00 00 00 00 00 00 00
E: 6.399919 8 63 00 00 00 00 00 00 00
E: 6.407930 8 63 00 00 00 00 00 00 00
E: 6.415911 8 63 00 00 00 00 00 00 00
E: 6.423920 8 63 00 00 00 00 00 00 00
E: 6.431907 8 63 00 00 00 00 00 00 00
E: 6.439912 8 63 00 00 00 00 00 00 00
E: 6.447909 8 63 00 00 00 00 00 00 00
E: 6.457307 8 02 90 0c 05 c6 04 00 00
E: 6.464001 8 02 90 0d 05 cd 04 00 00
E: 6.480582 8 02 90 10 05 da 04 00 00
E: 6.488515 8 02 90 19 05 d3 04 00 00
E: 6.496613 8 02 90 1b 05 c9 04 00 00
E: 6.504500 8 02 90 1f 05 c5 04 00 00
E: 6.511917 8 63 00 00 00 00 00 00 00
E: 6.520569 8 02 90 26 05 ce 04 00 00
E: 6.528724 8 02 90 28 05 e1 04 00 00
E: 6.536591 8 02 90 2c 05 ee 04 00 00
E: 6.552456 8 02 90 31 05 01 05 00 00
E: 6.560890 8 02 90 34 05 0a 05 00 00
E: 6.568484 8 02 90 3b 05 0f 05 00 00
E: 6.581412 8 02 90 40 05 0e 05 05 00
E: 6.583916 8 63 00 00 00 00 00 00 00
E: 6.591926 8 02 90 4f 05 0a 05 00 00
E: 6.599931 8 02 90 53 05 07 05 01 00
E: 6.607918 8 02 90 59 05 08 05 00 00
E: 6.623913 8 02 90 62 05 0a 05 01 00
E: 6.632422 8 02 90 78 05 09 05 00 00
E: 6.640170 8 02 90 83 05 0a 05 00 00
E: 6.648217 8 02 90 92 05 02 05 04 00
E: 6.666226 8 02 90 9c 05 f3 04 01 00
E: 6.671907 8 02 90 9d 05 e6 04 00 00
E: 6.679929 8 02 90 8b 05 d6 04 00 00
E: 6.688017 8 02 90 84 05 d6 04 00 00
E: 6.695966 8 63 00 00 00 00 00 00 00
E: 6.703933 8 02 90 72 05 d4 04 01 00
E: 6.711935 8 02 90 68 05 d7 04 00 00
E: 6.719916 8 02 90 61 05 d4 04 00 00
E: 6.736458 8 02 90 5b 05 d6 04 00 00
E: 6.743938 8 02 90 5b 05 d6 04 00 00
E: 6.752534 8 02 90 5b 05 d8 04 01 00
E: 6.760593 8 02 90 58 05 d9 04 01 00
E: 6.768637 8 63 00 00 00 00 00 00 00
E: 6.776416 8 02 90 5c 05 d9 04 00 00
E: 6.783974 8 02 90 5e 05 d8 04 01 00
E: 6.792018 8 02 90 5f 05 d6 04 00 00
E: 6.808024 8 02 90 60 05 d3 04 00 00
E: 6.816444 8 02 90 5e 05 cf 04 00 00
E: 6.824477 8 02 90 5a 05 ca 04 01 00
E: 6.836077 8 02 90 57 05 c4 04 04 00
E: 6.839897 8 63 00 00 00 00 00 00 00
E: 6.848028 8 02 90 51 05 c1 04 00 00
E: 6.856015 8 02 90 4b 05 bc 04 01 00
E: 6.868084 8 02 90 47 05 b7 04 00 00
E: 6.871904 8 02 90 42 05 b5 04 00 00
E: 6.879896 8 63 00 00 00 00 00 00 00
E: 6.888555 8 02 90 3b 05 b3 04 01 00
E: 6.896471 8 02 90 38 05 b6 04 01 00
E: 6.904392 8 02 90 35 05 bc 04 01 00
E: 6.920405 8 02 90 34 05 c4 04 00 00
E: 6.928460 8 02 90 32 05 ce 04 01 00
E: 6.936520 8 02 90 30 05 d6 04 00 00
E: 6.944545 8 02 90 2a 05 e9 04 00 00
E: 6.951911 8 63 00 00 00 00 00 00 00
E: 6.960472 8 02 90 24 05 f1 04 00 00
E: 6.968924 8 02 90 1e 05 02 05 00 00
E: 6.976599 8 02 90 1e 05 0a 05 00 00
E: 6.992435 8 02 90 19 05 11 05 00 00
E: 7.000425 8 02 90 1a 05 14 05 00 00
E: 7.008481 8 02 90 18 05 14 05 00 00
E: 7.016026 8 02 90 17 05 13 05 00 00
E: 7.023916 8 63 00 00 00 00 00 00 00
E: 7.032451 8 02 90 17 05 13 05 00 00
E: 7.040028 8 02 90 16 05 15 05 00 00
E: 7.053680 8 02 90 17 05 17 05 04 00
E: 7.063970 8 02 90 16 05 1a 05 00 00
E: 7.071966 8 02 90 16 05 1c 05 00 00
E: 7.084201 8 02 90 14 05 1f 05 00 00
E: 7.087899 8 02 90 12 05 24 05 00 00
E: 7.095889 8 63 00 00 00 00 00 00 00
E: 7.104316 8 02 90 10 05 26 05 00 00
E: 7.112279 8 02 90 0d 05 26 05 00 00
E: 7.119897 8 02 90 0e 05 24 05 00 00
E: 7.135990 8 02 90 0c 05 27 05 00 00
E: 7.143898 8 02 90 0d 05 25 05 00 00
E: 7.152382 8 02 90 0c 05 25 05 00 00
E: 7.160039 8 02 90 0f 05 23 05 01 00
E: 7.181415 8 02 90 10 05 24 05 05 00
E: 7.183923 8 02 90 12 05 25 05 00 00
E: 7.191947 8 02 90 13 05 23 05 00 00
E: 7.199932 8 02 90 16 05 24 05 01 00
E: 7.207904 8 63 00 00 00 00 00 00 00
E: 7.219724 8 02 90 15 05 21 05 05 00
E: 7.224935 8 02 90 13 05 21 05 01 00
E: 7.231938 8 02 90 12 05 23 05 01 00
E: 7.248007 8 02 90 12 05 23 05 00 00
E: 7.256003 8 02 90 10 05 24 05 01 00
E: 7.268116 8 02 90 11 05 26 05 01 00
E: 7.271919 8 02 90 14 05 2b 05 00 00
E: 7.279917 8 63 00 00 00 00 00 00 00
E: 7.288031 8 02 90 12 05 28 05 01 00
E: 7.296635 8 02 90 14 05 2b 05 00 00
E: 7.307496 8 02 90 12 05 28 05 04 00
E: 7.321005 8 02 90 12 05 2a 05 00 00
E: 7.328029 8 02 90 12 05 25 05 00 00
E: 7.336901 8 02 90 12 05 24 05 00 00
E: 7.343914 8 02 90 11 05 25 05 00 00
E: 7.364912 8 02 94 10 05 29 05 05 00
E: 7.367913 8 02 94 0d 05 28 05 00 00
E: 7.376052 8 02 94 0c 05 27 05 00 00
E: 7.384043 8 02 94 0c 05 24 05 00 00
E: 7.391913 8 63 00 00 00 00 00 00 00
E: 7.400298 8 02 94 0c 05 1f 05 00 00
E: 7.407988 8 02 94 0c 05 1e 05 00 00
E: 7.416088 8 02 94 0b 05 1c 05 01 00
E: 7.431994 8 02 94 08 05 1f 05 00 00
E: 7.440089 8 02 94 07 05 1f 05 01 00
E: 7.447984 8 02 94 09 05 1f 05 00 00
E: 7.455901 8 02 94 08 05 1c 05 01 00
E: 7.463902 8 63 00 00 00 00 00 00 00
E: 7.472761 8 02 94 07 05 1c 05 00 00
E: 7.479923 8 02 94 06 05 1c 05 00 00
E: 7.487944 8 02 94 05 05 1b 05 01 00
E: 7.503896 8 02 94 06 05 1d 05 01 00
E: 7.511967 8 02 94 07 05 1b 05 00 00
E: 7.519893 8 02 94 08 05 1c 05 00 00
E: 7.527918 8 02 94 0c 05 1c 05 00 00
E: 7.535931 8 63 00 00 00 00 00 00 00
E: 7.543931 8 02 94 0c 05 1c 05 01 00
E: 7.551949 8 02 94 0f 05 20 05 01 00
E: 7.559907 8 02 90 12 05 23 05 00 00
E: 7.578347 8 02 90 12 05 21 05 00 00
E: 7.590242 8 02 90 13 05 20 05 01 00
E: 7.591913 8 02 90 14 05 20 05 00 00
E: 7.600713 8 02 90 16 05 20 05 00 00
E: 7.607905 8 63 00 00 00 00 00 00 00
E: 7.616615 8 02 90 16 05 1f 05 01 00
E: 7.624023 8 02 90 17 05 21 05 00 00
E: 7.631907 8 02 90 18 05 23 05 00 00
E: 7.648029 8 02 90 1b 05 20 05 00 00
E: 7.656394 8 02 90 1c 05 20 05 00 00
E: 7.664004 8 02 90 1e 05 1e 05 01 00
E: 7.672469 8 02 90 20 05 1d 05 00 00
E: 7.687994 8 02 90 1e 05 1c 05 00 00
E: 7.696368 8 02 90 22 05 1b 05 01 00
E: 7.704034 8 02 90 23 05 1a 05 01 00
E: 7.712003 8 02 90 25 05 19 05 01 00
E: 7.719897 8 63 00 00 00 00 00 00 00
E: 7.728095 8 02 90 25 05 1a 05 00 00
E: 7.735915 8 02 90 25 05 1c 05 00 00
E: 7.743927 8 02 90 26 05 1c 05 01 00
E: 7.759915 8 02 90 25 05 21 05 00 00
E: 7.767908 8 02 90 26 05 1f 05 00 00
E: 7.775918 8 02 90 2a 05 1d 05 00 00
E: 7.783943 8 02 90 2b 05 1c 05 00 00
E: 7.791894 8 63 00 00 00 00 00 00 00
E: 7.799903 8 02 90 29 05 1c 05 00 00
E: 7.807941 8 02 90 2a 05 1a 05 00 00
E: 7.815911 8 02 90 27 05 18 05 01 00
E: 7.831915 8 02 90 28 05 16 05 01 00
E: 7.839937 8 02 90 29 05 11 05 00 00
E: 7.847923 8 02 90 28 05 0e 05 00 00
E: 7.855948 8 02 90 27 05 0c 05 00 00
E: 7.871919 8 02 90 28 05 0b 05 00 00
E: 7.879921 8 02 90 28 05 08 05 00 00
E: 7.887910 8 02 90 29 05 06 05 00 00
E: 7.903901 8 02 90 28 05 08 05 00 00
E: 7.911905 8 02 90 29 05 04 05 00 00
E: 7.919913 8 02 90 26 05 02 05 00 00
E: 7.927929 8 02 90 26 05 fe 04 00 00
E: 7.943910 8 02 90 21 05 f8 04 00 00
E: 7.951900 8 02 90 1f 05 ee 04 00 00
E: 7.959910 8 02 90 1e 05 d5 04 00 00
E: 7.967908 8 02 90 18 05 c6 04 00 00
E: 7.975893 8 63 00 00 00 00 00 00 00
E: 7.983906 8 02 90 14 05 ab 04 00 00
E: 7.991893 8 02 90 11 05 93 04 00 00
E: 7.999914 8 02 90 0c 05 85 04 00 00
E: 8.015915 8 02 90 05 05 66 04 00 00
E: 8.023926 8 02 90 00 05 4c 04 01 00
E: 8.031906 8 02 90 f8 04 3c 04 00 00
E: 8.039915 8 02 90 f3 04 28 04 01 00
E: 8.047912 8 63 00 00 00 00 00 00 00
E: 8.055918 8 02 90 f1 04 1f 04 00 00
E: 8.063910 8 02 90 f0 04 1d 04 00 00
E: 8.071912 8 02 90 ef 04 1b 04 00 00
E: 8.087913 8 02 90 f0 04 18 04 04 00
E: 8.095914 8 02 90 ec 04 16 04 00 00
E: 8.103921 8 02 90 ea 04 1a 04 01 00
E: 8.111902 8 02 90 e9 04 1d 04 00 00
E: 8.119900 8 63 00 00 00 00 00 00 00
E: 8.127943 8 02 90 e6 04 1f 04 00 00
E: 8.135946 8 02 90 e5 04 23 04 00 00
E: 8.144081 8 02 90 e5 04 24 04 01 00
E: 8.151945 8 02 90 e7 04 26 04 00 00
E: 8.159910 8 63 00 00 00 00 00 00 00
E: 8.167916 8 02 90 ea 04 2a 04 01 00
E: 8.175912 8 02 90 ec 04 32 04 00 00
E: 8.184383 8 02 90 f1 04 37 04 00 00
E: 8.201057 8 02 90 f3 04 3d 04 01 00
E: 8.208479 8 02 90 f4 04 3f 04 00 00
E: 8.216487 8 02 90 f4 04 43 04 00 00
E: 8.223913 8 02 90 f6 04 46 04 00 00
E: 8.231912 8 63 00 00 00 00 00 00 00
E: 8.239941 8 02 90 f7 04 46 04 01 00
E: 8.248477 8 02 90 f8 04 49 04 00 00
E: 8.256029 8 02 90 f9 04 4b 04 00 00
E: 8.272354 8 02 90 fc 04 4d 04 00 00
E: 8.280310 8 02 90 ff 04 50 04 00 00
E: 8.287989 8 02 90 01 05 54 04 00 00
E: 8.296397 8 02 90 01 05 55 04 00 00
E: 8.303918 8 63 00 00 00 00 00 00 00
E: 8.312011 8 02 90 04 05 57 04 00 00
E: 8.320376 8 02 90 06 05 5c 04 01 00
E: 8.328368 8 02 90 09 05 62 04 00 00
E: 8.344384 8 02 90 0b 05 64 04 01 00
E: 8.352349 8 02 90 0c 05 65 04 00 00
E: 8.359894 8 02 90 0c 05 65 04 00 00
E: 8.367893 8 02 90 0c 05 66 04 00 00
E: 8.375895 8 63 00 00 00 00 00 00 00
E: 8.384345 8 02 90 0e 05 6b 04 00 00
E: 8.392523 8 02 90 0f 05 70 04 00 00
E: 8.400578 8 02 90 13 05 7a 04 00 00
E: 8.415885 8 63 90 13 05 82 04 00 00
E: 8.424407 8 02 90 14 05 85 04 00 00
E: 8.432302 8 02 90 15 05 83 04 01 00
E: 8.440260 8 02 90 15 05 82 04 00 00
E: 8.455964 8 02 90 16 05 81 04 00 00
E: 8.463980 8 02 90 17 05 80 04 01 00
E: 8.472344 8 02 90 16 05 80 04 00 00
E: 8.479972 8 02 90 17 05 7f 04 01 00
E: 8.487884 8 63 00 00 00 00 00 00 00
E: 8.495969 8 02 90 18 05 7f 04 00 00
E: 8.503972 8 02 90 19 05 7e 04 01 00
E: 8.511971 8 02 90 1b 05 7e 04 01 00
E: 8.528335 8 02 90 1c 05 7e 04 00 00
E: 8.536008 8 02 90 1c 05 7d 04 00 00
E: 8.543968 8 02 90 20 05 7b 04 00 00
E: 8.552382 8 02 90 20 05 7b 04 00 00
E: 8.559895 8 63 00 00 00 00 00 00 00
E: 8.567970 8 02 90 22 05 7a 04 00 00
E: 8.576321 8 02 90 24 05 7c 04 00 00
E: 8.583977 8 02 90 23 05 7e 04 01 00
E: 8.599983 8 02 90 25 05 7e 04 00 00
E: 8.608400 8 02 90 25 05 7f 04 00 00
E: 8.615885 8 02 90 25 05 7f 04 00 00
E: 8.624032 8 02 90 27 05 80 04 00 00
E: 8.631891 8 63 00 00 00 00 00 00 00
E: 8.639987 8 02 90 26 05 82 04 00 00
E: 8.648390 8 02 90 28 05 83 04 00 00
E: 8.655969 8 02 90 2c 05 83 04 00 00
E: 8.663889 8 02 90 2c 05 83 04 00 00
E: 8.671880 8 63 00 00 00 00 00 00 00
E: 8.679896 8 02 90 2b 05 83 04 00 00
E: 8.687885 8 02 90 2b 05 81 04 00 00
E: 8.696330 8 02 90 2b 05 7f 04 00 00
E: 8.711984 8 02 90 2c 05 7e 04 00 00
E: 8.720180 8 02 90 2d 05 7e 04 00 00
E: 8.727894 8 02 90 2c 05 7e 04 00 00
E: 8.735889 8 02 90 2b 05 7f 04 00 00
E: 8.743887 8 63 00 00 00 00 00 00 00
E: 8.751898 8 02 90 2c 05 80 04 00 00
E: 8.759893 8 02 90 2b 05 7e 04 00 00
E: 8.768423 8 02 90 2a 05 7c 04 00 00
E: 8.784026 8 02 90 2c 05 7b 04 00 00
E: 8.791986 8 02 90 2c 05 7a 04 00 00
E: 8.800404 8 02 90 2c 05 7a 04 00 00
E: 8.808018 8 02 90 2d 05 79 04 00 00
E: 8.815880 8 63 00 00 00 00 00 00 00
E: 8.824008 8 02 90 2c 05 78 04 00 00
E: 8.832417 8 02 90 2c 05 75 04 00 00
E: 8.840073 8 02 90 2c 05 74 04 00 00
E: 8.856539 8 02 90 29 05 72 04 00 00
E: 8.864055 8 02 90 2a 05 71 04 00 00
E: 8.872310 8 02 90 2b 05 70 04 00 00
E: 8.880016 8 02 90 2a 05 6e 04 00 00
E: 8.887894 8 63 00 00 00 00 00 00 00
E: 8.896421 8 02 90 29 05 6b 04 01 00
E: 8.904037 8 02 90 2a 05 69 04 00 00
E: 8.912511 8 02 90 2a 05 65 04 01 00
E: 8.928401 8 02 90 29 05 61 04 00 00
E: 8.936340 8 02 90 27 05 5e 04 00 00
E: 8.944316 8 02 90 28 05 54 04 00 00
E: 8.952369 8 02 90 26 05 50 04 01 00
E: 8.968430 8 02 90 24 05 4b 04 00 00
E: 8.976398 8 02 90 24 05 47 04 00 00
E: 8.984446 8 02 90 21 05 3f 04 00 00
E: 8.992321 8 02 90 20 05 3b 04 00 00
E: 8.999890 8 63 00 00 00 00 00 00 00
E: 9.008411 8 02 90 1e 05 34 04 00 00
E: 9.016319 8 02 90 1d 05 31 04 00 00
E: 9.024303 8 02 90 1c 05 2b 04 00 00
E: 9.040422 8 02 90 1b 05 26 04 00 00
E: 9.048476 8 02 90 1a 05 25 04 00 00
E: 9.056574 8 02 90 1a 05 25 04 00 00
E: 9.063973 8 02 90 18 05 23 04 00 00
E: 9.071885 8 63 00 00 00 00 00 00 00
E: 9.080352 8 02 90 17 05 22 04 00 00
E: 9.087997 8 02 90 16 05 20 04 00 00
E: 9.096396 8 02 90 13 05 1b 04 00 00
E: 9.112343 8 02 90 12 05 17 04 00 00
E: 9.120282 8 02 90 0f 05 16 04 00 00
E: 9.128304 8 02 90 0c 05 14 04 00 00
E: 9.136398 8 02 90 08 05 19 04 00 00
E: 9.152049 8 02 90 08 05 1a 04 00 00
E: 9.160513 8 02 90 07 05 1b 04 00 00
E: 9.168029 8 02 90 07 05 19 04 00 00
E: 9.175887 8 02 90 07 05 19 04 00 00
E: 9.183884 8 63 00 00 00 00 00 00 00
E: 9.192329 8 02 90 06 05 17 04 00 00
E: 9.199886 8 02 90 06 05 18 04 00 00
E: 9.207988 8 02 90 06 05 18 04 01 00
E: 9.223985 8 02 90 05 05 18 04 00 00
E: 9.237634 8 02 90 04 05 17 04 05 00
E: 9.239897 8 02 90 02 05 19 04 00 00
E: 9.247925 8 02 90 02 05 19 04 00 00
E: 9.255869 8 63 00 00 00 00 00 00 00
E: 9.267585 8 02 90 ff 04 25 04 00 00
E: 9.271911 8 02 90 ff 04 26 04 01 00
E: 9.280386 8 02 90 fe 04 26 04 00 00
E: 9.296480 8 02 90 fc 04 26 04 00 00
E: 9.303963 8 02 90 fa 04 26 04 00 00
E: 9.311956 8 02 90 f9 04 24 04 01 00
E: 9.320533 8 02 90 f8 04 27 04 02 00
E: 9.327908 8 63 00 00 00 00 00 00 00
E: 9.336021 8 02 90 f7 04 28 04 00 00
E: 9.343972 8 02 90 f8 04 2c 04 00 00
E: 9.351965 8 02 90 f8 04 2d 04 00 00
E: 9.368463 8 02 90 f9 04 32 04 00 00
E: 9.376339 8 02 90 fa 04 36 04 00 00
E: 9.383884 8 02 90 fb 04 37 04 00 00
E: 9.392351 8 02 90 fb 04 3c 04 00 00
E: 9.399877 8 63 00 00 00 00 00 00 00
E: 9.407890 8 02 90 fc 04 3f 04 00 00
E: 9.416355 8 02 90 fe 04 44 04 00 00
E: 9.424512 8 02 90 ff 04 4e 04 00 00
E: 9.431879 8 02 90 00 05 50 04 00 00
E: 9.439888 8 63 00 00 00 00 00 00 00
E: 9.448563 8 02 90 03 05 55 04 00 00
E: 9.456345 8 02 90 03 05 5b 04 00 00
E: 9.464495 8 02 90 07 05 63 04 00 00
E: 9.480429 8 02 90 0b 05 65 04 00 00
E: 9.488535 8 02 90 0c 05 6b 04 01 00
E: 9.496416 8 02 90 0f 05 72 04 00 00
E: 9.504424 8 02 90 12 05 74 04 00 00
E: 9.511866 8 63 00 00 00 00 00 00 00
E: 9.520469 8 02 90 13 05 77 04 00 00
E: 9.528430 8 02 90 16 05 7a 04 00 00
E: 9.535871 8 02 90 15 05 7a 04 00 00
E: 9.552492 8 02 90 14 05 7e 04 00 00
E: 9.560398 8 02 90 16 05 7e 04 00 00
E: 9.568413 8 02 90 15 05 82 04 00 00
E: 9.575988 8 02 90 17 05 83 04 00 00
E: 9.583876 8 63 00 00 00 00 00 00 00
E: 9.592353 8 02 90 1a 05 84 04 00 00
E: 9.599962 8 02 90 1b 05 87 04 00 00
E: 9.608098 8 02 90 1c 05 88 04 00 00
E: 9.624678 8 02 90 1e 05 8b 04 01 00
E: 9.631882 8 02 90 1f 05 8d 04 01 00
E: 9.639887 8 02 90 1f 05 8e 04 00 00
E: 9.647890 8 02 90 1e 05 91 04 00 00
E: 9.655869 8 63 00 00 00 00 00 00 00
E: 9.663897 8 02 90 1e 05 92 04 00 00
E: 9.671868 8 02 90 1d 05 91 04 00 00
E: 9.679886 8 02 90 1d 05 92 04 00 00
E: 9.687879 8 02 90 1f 05 92 04 00 00
E: 9.695885 8 63 00 00 00 00 00 00 00
E: 9.703886 8 02 90 22 05 93 04 00 00
E: 9.711882 8 02 90 20 05 96 04 04 00
E: 9.719901 8 02 90 21 05 98 04 00 00
E: 9.736870 8 02 90 20 05 99 04 00 00
E: 9.743888 8 02 90 20 05 9a 04 00 00
E: 9.751874 8 02 90 1f 05 99 04 00 00
E: 9.759894 8 02 90 20 05 97 04 00 00
E: 9.767897 8 63 00 00 00 00 00 00 00
E: 9.777722 8 02 90 1f 05 97 04 01 00
E: 9.783877 8 02 90 1e 05 99 04 01 00
E: 9.791965 8 02 90 1d 05 9b 04 00 00
E: 9.807897 8 02 90 1d 05 9a 04 00 00
E: 9.816460 8 02 90 1c 05 9c 04 00 00
E: 9.824010 8 02 90 1d 05 a0 04 00 00
E: 9.832344 8 02 90 1c 05 a4 04 00 00
E: 9.839888 8 63 00 00 00 00 00 00 00
E: 9.848468 8 02 90 20 05 a9 04 00 00
E: 9.856374 8 02 90 24 05 b0 04 00 00
E: 9.864587 8 02 90 24 05 b6 04 00 00
E: 9.880413 8 02 90 24 05 bc 04 00 00
E: 9.888332 8 02 90 24 05 c2 04 01 00
E: 9.896324 8 02 90 28 05 ca 04 00 00
E: 9.904412 8 02 90 2a 05 d7 04 01 00
E: 9.911870 8 63 00 00 00 00 00 00 00
E: 9.920816 8 02 90 2d 05 df 04 01 00
E: 9.928409 8 02 90 2f 05 e8 04 01 00
E: 9.936377 8 02 90 31 05 eb 04 00 00
E: 9.952739 8 02 90 32 05 f3 04 00 00
E: 9.960372 8 02 90 34 05 f4 04 00 00
E: 9.968412 8 02 90 33 05 fb 04 00 00
E: 9.976340 8 02 90 37 05 ff 04 00 00
E: 9.992306 8 02 90 39 05 03 05 00 00
E: 10.000351 8 02 90 39 05 05 05 00 00
E: 10.007993 8 02 90 38 05 07 05 01 00
E: 10.016326 8 02 90 36 05 06 05 00 00
E: 10.023872 8 63 00 00 00 00 00 00 00
E: 10.031979 8 02 90 38 05 09 05 00 00
E: 10.040369 8 02 90 39 05 13 05 01 00
E: 10.048368 8 02 90 3a 05 13 05 00 00
E: 10.064759 8 02 90 3e 05 15 05 05 00
E: 10.071912 8 02 90 3b 05 22 05 00 00
E: 10.079889 8 02 90 38 05 21 05 00 00
E: 10.087885 8 02 90 37 05 20 05 05 00
E: 10.095873 8 63 00 00 00 00 00 00 00
E: 10.103875 8 02 90 33 05 2a 05 00 00
E: 10.111867 8 02 90 34 05 28 05 00 00
E: 10.119882 8 02 90 32 05 21 05 00 00
E: 10.136892 8 02 90 32 05 20 05 00 00
E: 10.143892 8 02 90 32 05 1e 05 00 00
E: 10.151870 8 02 90 32 05 1c 05 00 00
E: 10.160306 8 02 90 32 05 1a 05 00 00
E: 10.167872 8 63 00 00 00 00 00 00 00
E: 10.175927 8 02 90 32 05 19 05 00 00
E: 10.183929 8 02 90 30 05 1a 05 00 00
E: 10.192327 8 02 90 2d 05 1a 05 00 00
E: 10.207965 8 02 90 2b 05 1c 05 00 00
E: 10.216434 8 02 90 2b 05 1b 05 00 00
E: 10.224412 8 02 90 24 05 19 05 00 00
E: 10.232325 8 02 90 20 05 17 05 00 00
E: 10.247971 8 02 90 21 05 14 05 00 00
E: 10.256383 8 02 90 1b 05 0d 05 00 00
E: 10.264542 8 02 90 1a 05 0b 05 00 00
E: 10.272397 8 02 90 16 05 08 05 00 00
E: 10.279882 8 63 00 00 00 00 00 00 00
E: 10.288659 8 02 90 0e 05 08 05 00 00
E: 10.296533 8 02 90 09 05 03 05 00 00
E: 10.304467 8 02 90 00 05 01 05 00 00
E: 10.320447 8 02 90 fb 04 02 05 01 00
E: 10.328487 8 02 90 fa 04 03 05 00 00
E: 10.335883 8 02 90 fc 04 03 05 00 00
E: 10.344707 8 02 90 fc 04 05 05 01 00
E: 10.351911 8 63 00 00 00 00 00 00 00
E: 10.360022 8 02 90 fe 04 03 05 02 00
E: 10.371702 8 02 90 ff 04 05 05 0d 00
E: 10.375898 8 02 90 ff 04 04 05 09 00
E: 10.392009 8 02 90 ff 04 05 05 0c 00
E: 10.404348 8 02 90 ff 04 04 05 12 00
E: 10.407924 8 02 90 ff 04 04 05 16 00
E: 10.415877 8 02 90 ff 04 05 05 1c 00
E: 10.424562 8 63 00 00 00 00 00 00 00
E: 10.431866 8 02 90 ff 04 04 05 1c 00
E: 10.440312 8 02 90 ff 04 04 05 20 00
E: 10.447971 8 02 90 fe 04 05 05 22 00
E: 10.464255 8 02 90 fe 04 05 05 26 00
E: 10.471874 8 02 90 ff 04 04 05 26 00
E: 10.480314 8 02 90 fe 04 05 05 2b 00
E: 10.487874 8 02 90 ff 04 06 05 2b 00
E: 10.504349 8 02 90 ff 04 06 05 31 00
E: 10.512285 8 02 90 ff 04 05 05 26 00
E: 10.520260 8 02 90 ff 04 06 05 23 00
E: 10.528317 8 02 90 ff 04 06 05 1d 00
E: 10.535867 8 63 00 00 00 00 00 00 00
E: 10.544328 8 02 90 ff 04 05 05 09 00
E: 10.552271 8 02 90 ff 04 06 05 06 00
E: 10.560780 8 02 90 fe 04 05 05 00 00
E: 10.575920 8 02 90 fe 04 02 05 00 00
E: 10.584685 8 02 90 fe 04 f9 04 00 00
E: 10.592475 8 02 90 ff 04 f1 04 00 00
E: 10.600438 8 02 90 04 05 f2 04 00 00
E: 10.607893 8 63 00 00 00 00 00 00 00
E: 10.616548 8 02 90 09 05 f5 04 00 00
E: 10.624576 8 02 90 0c 05 fb 04 00 00
E: 10.632416 8 02 90 10 05 01 05 00 00
E: 10.648558 8 02 90 11 05 06 05 00 00
E: 10.656442 8 02 90 1a 05 0a 05 00 00
E: 10.664410 8 02 90 1a 05 10 05 00 00
E: 10.672490 8 02 90 17 05 0c 05 00 00
E: 10.679878 8 63 00 00 00 00 00 00 00
E: 10.688078 8 02 90 14 05 fe 04 00 00
E: 10.696471 8 02 90 10 05 f0 04 00 00
E: 10.704492 8 02 90 09 05 e6 04 00 00
E: 10.712448 8 02 90 08 05 e4 04 00 00
E: 10.719876 8 63 00 00 00 00 00 00 00
E: 10.731656 8 02 90 07 05 df 04 04 00
E: 10.735878 8 02 90 06 05 d3 04 01 00
E: 10.743977 8 02 90 05 05 d1 04 00 00
E: 10.763587 8 02 90 02 05 c4 04 00 00
E: 10.767870 8 02 90 00 05 bc 04 04 00
E: 10.777529 8 02 90 fe 04 b0 04 00 00
E: 10.784385 8 02 90 fc 04 ab 04 00 00
E: 10.794366 8 63 00 00 00 00 00 00 00
E: 10.799945 8 02 90 f9 04 aa 04 00 00
E: 10.807981 8 02 90 f6 04 ab 04 00 00
E: 10.815900 8 02 90 f6 04 ad 04 01 00
E: 10.832325 8 02 90 f4 04 b0 04 00 00
E: 10.839921 8 02 90 f4 04 b0 04 01 00
E: 10.848093 8 02 90 f5 04 b0 04 00 00
E: 10.855867 8 02 90 f5 04 b3 04 00 00
E: 10.863867 8 63 00 00 00 00 00 00 00
E: 10.871866 8 02 90 f7 04 b4 04 00 00
E: 10.879868 8 02 90 fb 04 b7 04 01 00
E: 10.887882 8 02 90 fc 04 bc 04 01 00
E: 10.903875 8 02 90 ff 04 c3 04 00 00
E: 10.911875 8 02 90 ff 04 ca 04 00 00
E: 10.919885 8 02 90 02 05 cc 04 00 00
E: 10.927885 8 02 90 04 05 cd 04 00 00
E: 10.944386 8 02 90 03 05 d1 04 00 00
E: 10.952039 8 02 90 04 05 d1 04 00 00
E: 10.960441 8 02 90 07 05 d5 04 00 00
E: 10.967976 8 02 90 07 05 d9 04 01 00
E: 10.975862 8 63 00 00 00 00 00 00 00
E: 10.984312 8 02 90 09 05 dc 04 01 00
E: 10.992343 8 02 90 09 05 df 04 01 00
E: 11.000541 8 02 90 0a 05 e2 04 00 00
E: 11.016462 8 02 90 0c 05 e2 04 00 00
E: 11.024004 8 02 90 0d 05 e1 04 01 00
E: 11.032518 8 02 90 0d 05 e0 04 00 00
E: 11.040016 8 02 90 0e 05 df 04 01 00
E: 11.047872 8 63 00 00 00 00 00 00 00
E: 11.055959 8 02 90 0c 05 df 04 00 00
E: 11.063959 8 02 90 0c 05 dd 04 00 00
E: 11.072506 8 02 90 0e 05 dc 04 00 00
E: 11.087865 8 02 90 0f 05 df 04 00 00
E: 11.095861 8 02 90 0f 05 df 04 00 00
E: 11.103865 8 02 90 0f 05 e1 04 00 00
E: 11.111857 8 02 90 0f 05 e1 04 00 00
E: 11.119866 8 63 00 00 00 00 00 00 00
E: 11.128023 8 02 90 0e 05 e2 04 00 00
E: 11.135961 8 02 90 0f 05 e2 04 01 00
E: 11.144006 8 02 90 0e 05 e2 04 00 00
E: 11.159962 8 02 90 0f 05 e4 04 00 00
E: 11.167860 8 02 90 0f 05 e3 04 00 00
E: 11.175856 8 02 90 0e 05 e1 04 00 00
E: 11.183977 8 02 90 0c 05 e0 04 00 00
E: 11.199968 8 02 90 0c 05 db 04 01 00
E: 11.207942 8 02 90 0c 05 d8 04 00 00
E: 11.216370 8 02 90 0d 05 d4 04 00 00
E: 11.232319 8 02 90 0c 05 d0 04 00 00
E: 11.240346 8 02 90 0c 05 cb 04 00 00
E: 11.251655 8 02 90 0c 05 c7 04 04 00
E: 11.255885 8 02 90 0a 05 c3 04 00 00
E: 11.271932 8 02 94 09 05 be 04 01 00
E: 11.279972 8 02 94 08 05 bb 04 00 00
E: 11.287876 8 02 94 07 05 b7 04 00 00
E: 11.295868 8 02 94 06 05 b4 04 04 00
E: 11.303873 8 63 00 00 00 00 00 00 00
E: 11.311883 8 02 94 05 05 b0 04 00 00
E: 11.319881 8 02 94 06 05 af 04 00 00
E: 11.327945 8 02 94 05 05 aa 04 00 00
E: 11.343959 8 02 94 02 05 a7 04 00 00
E: 11.351866 8 02 94 ff 04 a5 04 00 00
E: 11.359862 8 02 94 ff 04 a5 04 01 00
E: 11.367873 8 02 94 fb 04 a2 04 00 00
E: 11.375853 8 63 00 00 00 00 00 00 00
E: 11.383873 8 02 94 fb 04 a3 04 00 00
E: 11.391879 8 02 94 fb 04 a4 04 00 00
E: 11.399866 8 02 94 fc 04 a6 04 00 00
E: 11.417038 8 02 94 fc 04 a7 04 04 00
E: 11.428094 8 02 94 fa 04 a9 04 01 00
E: 11.431871 8 02 94 fa 04 ab 04 01 00
E: 11.439902 8 02 94 fa 04 af 04 01 00
E: 11.456034 8 02 94 fa 04 b2 04 01 00
E: 11.464369 8 02 94 f8 04 bd 04 00 00
E: 11.472422 8 02 94 f5 04 c6 04 00 00
E: 11.479941 8 02 94 f4 04 cd 04 01 00
E: 11.487869 8 63 00 00 00 00 00 00 00
E: 11.496479 8 02 94 f3 04 d1 04 00 00
E: 11.504415 8 02 94 f2 04 d3 04 00 00
E: 11.512493 8 02 94 f2 04 d3 04 03 00
E: 11.528346 8 02 94 f1 04 d0 04 00 00
E: 11.536032 8 02 94 ef 04 d3 04 00 00
E: 11.543871 8 02 94 f2 04 d1 04 00 00
E: 11.552287 8 02 94 f4 04 ca 04 00 00
E: 11.559889 8 63 00 00 00 00 00 00 00
E: 11.568600 8 02 94 f0 04 c4 04 00 00
E: 11.576426 8 02 94 f1 04 bd 04 00 00
E: 11.584262 8 02 94 f3 04 bc 04 01 00
E: 11.600408 8 02 94 f3 04 ba 04 00 00
E: 11.608739 8 02 94 f2 04 bb 04 14 00
E: 11.616283 8 02 94 f0 04 bc 04 19 00
E: 11.624330 8 02 94 f0 04 be 04 32 00
E: 11.631859 8 63 00 00 00 00 00 00 00
E: 11.639943 8 02 94 ee 04 c0 04 33 00
E: 11.648266 8 02 95 ee 04 c2 04 50 00
E: 11.656293 8 02 95 ec 04 c3 04 64 00
E: 11.672268 8 02 95 ea 04 c4 04 75 00
E: 11.680313 8 02 95 ea 04 c5 04 87 00
E: 11.688311 8 02 95 e7 04 c6 04 91 00
E: 11.696273 8 02 95 e6 04 c5 04 9c 00
E: 11.703867 8 63 00 00 00 00 00 00 00
E: 11.712287 8 02 95 e6 04 c6 04 a8 00
E: 11.720344 8 02 95 e7 04 c7 04 b0 00
E: 11.728350 8 02 95 e6 04 c7 04 b7 00
E: 11.736319 8 02 95 e5 04 c8 04 bc 00
E: 11.743890 8 63 00 00 00 00 00 00 00
E: 11.752518 8 02 95 e4 04 c7 04 bf 00
E: 11.760428 8 02 95 e5 04 c7 04 c2 00
E: 11.768409 8 02 95 e5 04 c7 04 b7 00
E: 11.784448 8 02 95 e5 04 c6 04 91 00
E: 11.792459 8 02 95 e3 04 c4 04 58 00
E: 11.800478 8 02 95 dd 04 be 04 39 00
E: 11.808306 8 02 94 db 04 ba 04 0c 00
E: 11.815877 8 63 00 00 00 00 00 00 00
E: 11.827857 8 02 94 d9 04 b6 04 00 00
E: 11.831880 8 02 94 d9 04 b1 04 00 00
E: 11.839873 8 02 94 d7 04 ad 04 00 00
E: 11.855868 8 02 94 d6 04 ac 04 00 00
E: 11.863877 8 02 94 d2 04 ad 04 00 00
E: 11.872401 8 02 94 d1 04 ae 04 00 00
E: 11.879980 8 02 94 d0 04 b0 04 00 00
E: 11.887867 8 63 00 00 00 00 00 00 00
E: 11.896436 8 02 94 ce 04 b5 04 00 00
E: 11.904620 8 02 94 d0 04 bb 04 00 00
E: 11.911864 8 02 94 cc 04 c3 04 00 00
E: 11.927958 8 02 94 cd 04 c5 04 01 00
E: 11.935863 8 02 94 ce 04 c8 04 00 00
E: 11.943881 8 02 94 cd 04 ca 04 01 00
E: 11.951946 8 02 94 cf 04 cd 04 00 00
E: 11.959840 8 63 00 00 00 00 00 00 00
E: 11.968417 8 02 94 ce 04 cf 04 00 00
E: 11.976829 8 02 94 cf 04 d1 04 00 00
E: 11.984379 8 02 94 d1 04 d2 04 00 00
E: 11.991959 8 02 94 d2 04 d4 04 00 00
E: 11.999870 8 63 00 00 00 00 00 00 00
E: 12.007849 8 02 94 d3 04 d5 04 00 00
E: 12.016317 8 02 94 d4 04 d5 04 00 00
E: 12.023958 8 02 94 d6 04 d6 04 00 00
E: 12.040467 8 02 94 d7 04 d6 04 01 00
E: 12.047990 8 02 94 d8 04 d5 04 00 00
E: 12.056389 8 02 94 d9 04 d5 04 01 00
E: 12.063980 8 02 94 da 04 d6 04 00 00
E: 12.071850 8 63 00 00 00 00 00 00 00
E: 12.079942 8 02 94 dc 04 d8 04 00 00
E: 12.088388 8 02 94 de 04 d9 04 00 00
E: 12.095994 8 02 94 e0 04 da 04 00 00
E: 12.112431 8 02 94 e2 04 dc 04 01 00
E: 12.119971 8 02 94 e2 04 df 04 01 00
E: 12.128459 8 02 94 e5 04 e0 04 00 00
E: 12.135981 8 02 94 e7 04 e1 04 00 00
E: 12.143864 8 63 00 00 00 00 00 00 00
E: 12.152450 8 02 94 ea 04 e2 04 00 00
E: 12.159999 8 02 94 ed 04 e4 04 00 00
E: 12.168385 8 02 94 ee 04 e5 04 00 00
E: 12.183990 8 02 94 f1 04 e6 04 00 00
E: 12.192544 8 02 94 f4 04 e9 04 00 00
E: 12.200026 8 02 94 f6 04 e9 04 00 00
E: 12.208374 8 02 94 f8 04 ea 04 00 00
E: 12.224462 8 02 94 f9 04 ea 04 00 00
E: 12.232003 8 02 94 fc 04 ea 04 01 00
E: 12.240769 8 02 94 fe 04 ed 04 01 00
E: 12.255866 8 02 94 fe 04 ed 04 01 00
E: 12.263986 8 02 94 00 05 f0 04 01 00
E: 12.272359 8 02 94 00 05 f0 04 00 00
E: 12.279857 8 02 94 00 05 f0 04 00 00
E: 12.295961 8 02 94 00 05 f1 04 00 00
E: 12.304510 8 02 90 02 05 f1 04 00 00
E: 12.312409 8 02 90 07 05 f1 04 00 00
E: 12.319851 8 02 90 0a 05 f0 04 00 00
E: 12.327859 8 63 00 00 00 00 00 00 00
E: 12.336323 8 02 90 0d 05 f4 04 00 00
E: 12.344258 8 02 90 10 05 fb 04 00 00
E: 12.352228 8 02 90 0c 05 ff 04 00 00
E: 12.368328 8 02 90 08 05 ff 04 00 00
E: 12.376240 8 02 90 06 05 ff 04 00 00
E: 12.383914 8 02 90 04 05 fd 04 00 00
E: 12.392259 8 02 90 05 05 fa 04 00 00
E: 12.399840 8 63 00 00 00 00 00 00 00
E: 12.407853 8 02 90 05 05 fc 04 00 00
E: 12.415909 8 02 90 03 05 fe 04 00 00
E: 12.423920 8 02 90 02 05 fe 04 00 00
E: 12.440270 8 02 90 03 05 00 05 00 00
E: 12.447842 8 02 90 04 05 01 05 00 00
E: 12.455838 8 02 90 04 05 00 05 00 00
E: 12.463912 8 02 90 07 05 02 05 00 00
E: 12.479843 8 02 90 06 05 02 05 00 00
E: 12.487847 8 02 90 07 05 02 05 00 00
E: 12.495857 8 02 90 07 05 03 05 00 00
E: 12.504365 8 02 90 06 05 06 05 00 00
E: 12.511871 8 63 00 00 00 00 00 00 00
E: 12.519872 8 02 90 06 05 03 05 00 00
E: 12.527961 8 02 90 07 05 01 05 00 00
E: 12.536047 8 02 90 08 05 03 05 00 00
E: 12.551854 8 02 90 05 05 01 05 00 00
E: 12.559859 8 02 90 05 05 02 05 00 00
E: 12.568614 8 02 90 05 05 00 05 00 00
E: 12.575878 8 02 90 07 05 00 05 00 00
E: 12.583867 8 63 00 00 00 00 00 00 00
E: 12.591983 8 02 90 0a 05 ff 04 00 00
E: 12.599973 8 02 90 0b 05 fc 04 00 00
E: 12.608498 8 02 90 10 05 f7 04 01 00
E: 12.624382 8 02 90 0d 05 f5 04 01 00
E: 12.632356 8 02 90 0c 05 ec 04 01 00
E: 12.640315 8 02 90 0f 05 e6 04 00 00
E: 12.647994 8 02 10 0c 05 e7 04 00 00
E: 12.655845 8 63 00 00 00 00 00 00 00
E: 12.663835 8 02 10 0c 05 f5 04 00 00
E: 12.671835 8 02 10 fe 04 00 05 00 00
E: 12.687850 8 02 00 00 00 00 00 00 00
