
Bus 001 Device 004: ID 04f3:2072 Elan Microelectronics Corp. 
Device Descriptor:
  bLength                18
  bDescriptorType         1
  bcdUSB               2.01
  bDeviceClass            0 (Defined at Interface level)
  bDeviceSubClass         0 
  bDeviceProtocol         0 
  bMaxPacketSize0         8
  idVendor           0x04f3 Elan Microelectronics Corp.
  idProduct          0x2072 
  bcdDevice           51.07
  iManufacturer           4 ELAN
  iProduct               14 Touchscreen
  iSerial                 0 
  bNumConfigurations      1
  Configuration Descriptor:
    bLength                 9
    bDescriptorType         2
    wTotalLength           41
    bNumInterfaces          1
    bConfigurationValue     1
    iConfiguration          0 
    bmAttributes         0xe0
      Self Powered
      Remote Wakeup
    MaxPower              100mA
    Interface Descriptor:
      bLength                 9
      bDescriptorType         4
      bInterfaceNumber        0
      bAlternateSetting       0
      bNumEndpoints           2
      bInterfaceClass         3 Human Interface Device
      bInterfaceSubClass      0 No Subclass
      bInterfaceProtocol      0 None
      iInterface              0 
        HID Device Descriptor:
          bLength                 9
          bDescriptorType        33
          bcdHID               1.10
          bCountryCode            0 Not supported
          bNumDescriptors         1
          bDescriptorType        34 Report
          wDescriptorLength    1072
         Report Descriptors: 
           ** UNAVAILABLE **
      Endpoint Descriptor:
        bLength                 7
        bDescriptorType         5
        bEndpointAddress     0x81  EP 1 IN
        bmAttributes            3
          Transfer Type            Interrupt
          Synch Type               None
          Usage Type               Data
        wMaxPacketSize     0x0040  1x 64 bytes
        bInterval               1
      Endpoint Descriptor:
        bLength                 7
        bDescriptorType         5
        bEndpointAddress     0x02  EP 2 OUT
        bmAttributes            3
          Transfer Type            Interrupt
          Synch Type               None
          Usage Type               Data
        wMaxPacketSize     0x0040  1x 64 bytes
        bInterval               2
Binary Object Store Descriptor:
  bLength                 5
  bDescriptorType        15
  wTotalLength           12
  bNumDeviceCaps          1
  USB 2.0 Extension Device Capability:
    bLength                 7
    bDescriptorType        16
    bDevCapabilityType      2
    bmAttributes   0x00000002
      Link Power Management (LPM) Supported
Device Status:     0x0003
  Self Powered
  Remote Wakeup Enabled
