Bus 001 Device 003: ID 056a:5010 Wacom Co., Ltd 
Device Descriptor: 
  bLength                18 
  bDescriptorType         1 
  bcdUSB               2.00 
  bDeviceClass            0 (Defined at Interface level) 
  bDeviceSubClass         0 
  bDeviceProtocol         0 
  bMaxPacketSize0        64 
  idVendor           0x056a Wacom Co., Ltd 
  idProduct          0x5010 
  bcdDevice            0.14 
  iManufacturer           1 Wacom Co.,Ltd. 
  iProduct                2 MultiTouch Sensor 
  iSerial                 0 
  bNumConfigurations      1 
  Configuration Descriptor: 
    bLength                 9 
    bDescriptorType         2 
    wTotalLength           34 
    bNumInterfaces          1 
    bConfigurationValue     1 
    iConfiguration          0 
    bmAttributes         0xe0 
      Self Powered 
      Remote Wakeup 
    MaxPower               16mA 
    Interface Descriptor: 
      bLength                 9 
      bDescriptorType         4 
      bInterfaceNumber        0 
      bAlternateSetting       0 
      bNumEndpoints           1 
      bInterfaceClass         3 Human Interface Device 
      bInterfaceSubClass      0 No Subclass 
      bInterfaceProtocol      0 None 
      iInterface              3 MultiTouch 
        HID Device Descriptor: 
          bLength                 9 
          bDescriptorType        33 
          bcdHID               1.11 
          bCountryCode            0 Not supported 
          bNumDescriptors         1 
          bDescriptorType        34 Report 
          wDescriptorLength     537 
         Report Descriptors: 
           ** UNAVAILABLE ** 
      Endpoint Descriptor: 
        bLength                 7 
        bDescriptorType         5 
        bEndpointAddress     0x81  EP 1 IN 
        bmAttributes            3 
          Transfer Type            Interrupt 
          Synch Type               None 
          Usage Type               Data 
        wMaxPacketSize     0x0040  1x 64 bytes 
        bInterval               2 
Device Status:     0x0000 
  (Bus Powered) 

