D: 0
R: 215 05 0d 09 02 a1 01 85 02 09 02 a1 00 05 01 09 30 09 31 15 00 26 80 07 35 00 46 00 78 65 11 55 0e 75 10 95 02 81 02 05 0d 09 42 09 45 09 44 09 32 15 00 25 01 75 01 95 04 65 00 81 02 05 09 19 01 29 04 15 00 25 01 75 01 95 04 81 02 05 0d 09 30 15 00 26 00 04 75 10 95 01 81 02 05 0d 09 3d 09 3e 15 81 25 7f 75 08 95 02 81 02 c0 05 01 09 00 85 04 15 00 26 ff 00 75 08 95 0c 81 02 05 01 09 00 85 08 15 00 26 ff 00 75 08 95 3b 81 02 09 01 85 80 75 08 95 20 b1 02 c0 05 01 09 02 a1 01 85 01 09 01 a1 00 05 01 09 30 09 31 15 00 26 80 07 35 00 46 00 78 65 11 55 0e 75 10 95 02 81 02 05 09 19 01 29 03 15 00 25 01 75 01 95 03 65 00 81 02 95 05 81 01 c0 c0
N: Wacom, Inc. MSC Device
P: usb-0000:00:1d.0-1.6.2/input0
I: 3 056a 0221
